username, date, retweets, text, id, permalink
snook_OG,2017-05-01 19:43,0,"Niggas bragging about being petty...lol I can't make this up","859191471731298304",https://twitter.com/snook_OG/status/859191471731298304
AlphaMikeFox2,2017-05-01 19:33,16,"Portland May Day Protests cancelled due to urination/defecation in streets. I literally just heard that on KIRO Radio. Can't make this up .","859189142458118145",https://twitter.com/AlphaMikeFox2/status/859189142458118145
JaKeem_Bolden,2017-05-01 19:33,0,"My whole team palms itching for that " " .. I c an't m ake t his u p","859188998463524865",https://twitter.com/JaKeem_Bolden/status/859188998463524865
Afrezzaguy,2017-05-01 19:27,13,"What can I say? Can't make this up so so much easier +the stress of being diabetic almost disappears. I Go 2bed always feeling I will wake up pic.twitter.com/Trq1qW2roE","859187638791622656",https://twitter.com/Afrezzaguy/status/859187638791622656
earlbeezyy,2017-05-01 19:22,0,"I can't make this shit up","859186228717137923",https://twitter.com/earlbeezyy/status/859186228717137923
King_Joker1721,2017-05-01 19:06,0,"http://www. cnn.com/2017/05/01/pol itics/trump-michelle-obama-girls-education/index.html … but I thought #ivanka was a #feminist champion? swear you can't make this up ! #complicitivanka","859182144735907842",https://twitter.com/King_Joker1721/status/859182144735907842
mrwrong2017,2017-05-01 19:02,0,"I can't make this shit up .","859181330935853056",https://twitter.com/mrwrong2017/status/859181330935853056
gwpurnell,2017-05-01 19:01,0,"This sounds like the wishfullest of thinking. Or complete bollocks. I can't make up my mind. https:// twitter.com/sebkraemer/sta tus/859178416033214464 …","859181089461612544",https://twitter.com/gwpurnell/status/859181089461612544
tonebrann,2017-05-01 19:00,0,"I just missed the train because 3 separate people were struggling to get their suitcases through the turnstiles, u can't make this shit up .","859180681481637889",https://twitter.com/tonebrann/status/859180681481637889
KeoniTylerPub,2017-05-01 18:55,0,"@SethAbramovitch Seth, watch: ( I sent this to Alina A. – You can't make this stuff up !) Back to Arthur at THR. Uh, my name is Seth, Keoni. https:// twitter.com/KeoniTylerPub/ status/854808310679191553 …","859179552207024128",https://twitter.com/KeoniTylerPub/status/859179552207024128
tinytwink,2017-05-01 18:52,0,"I have 4 kids. We both work a total of 100 hrs a week. We can't make ends meet and she does not get this AT all. I have given up explaining","859178718320873473",https://twitter.com/tinytwink/status/859178718320873473
deerlings_,2017-05-01 18:51,0,"i can't make this shit up","859178473767657472",https://twitter.com/deerlings_/status/859178473767657472
derigansilver,2017-05-01 18:39,1,"My hypotheticals just can't keep up with real world #medialaw anymore. I couldn't make this up if I tried. https:// twitter.com/slate/status/8 59173809257140224 …","859175564799873031",https://twitter.com/derigansilver/status/859175564799873031
WillardJBradley,2017-05-01 18:33,0,"Can't make this stuff up .. whilst gassing up my car I totally saw a kid cross the street running like Naruto.","859174021094559745",https://twitter.com/WillardJBradley/status/859174021094559745
davetrull,2017-05-01 18:23,0,"I 'm driving down US 19 in Pinellas Park and the car next to me asks for directions to the airport...in Miami. Ya can't make this stuff up !","859171521457250304",https://twitter.com/davetrull/status/859171521457250304
LCPkenjac,2017-05-01 18:21,0,"Can't make this shit up , literally 2 seconds after I tweet it. pic.twitter.com/BK0WJlzWcF","859170995877412864",https://twitter.com/LCPkenjac/status/859170995877412864
X2yoon,2017-05-01 18:20,0,"I saw a girl taking selfies of herself & her phone case was a selfie of her with the flower crown Snapchat filter.... I can't make this up","859170626577342464",https://twitter.com/X2yoon/status/859170626577342464
_007Fat,2017-05-01 18:19,0,"dick game amazing I can't make this up","859170442392858624",https://twitter.com/_007Fat/status/859170442392858624
mama_audge,2017-05-01 18:18,0,"I can't make this stuff up , people.","859170309076795393",https://twitter.com/mama_audge/status/859170309076795393
FreedomVoice001,2017-05-01 18:18,0,"''How about that Kanu in the arms of FFK. I can't make this shit up . I 'm not that good!''- Teekay Akin","859170090130034688",https://twitter.com/FreedomVoice001/status/859170090130034688
teekayakin01,2017-05-01 18:17,0,"''How about that Kanu in the arms of FFK. I can't make this shit up . I 'm not that good!''- Teekay Akin","859170024208166913",https://twitter.com/teekayakin01/status/859170024208166913
OBHMookie,2017-05-01 18:14,0,"I can't spell for shit but on the gz I got a roll to make up for this shit hahahahaha","859169069957881857",https://twitter.com/OBHMookie/status/859169069957881857
Silly_DatGuy,2017-05-01 18:05,0,"You can't take that well I can take this but i learn how to make it turn that straight to a g stack stacked all my cheese up","859166842765676548",https://twitter.com/Silly_DatGuy/status/859166842765676548
thescarletswan,2017-05-01 18:02,0,"It's shameful that @this point in the year I can't make myself do schoolwork unless I stock up on snacks to eat while I do it.","859166236369989632",https://twitter.com/thescarletswan/status/859166236369989632
EvvyKube,2017-05-01 17:57,0,"I accidentally read this can't make them shut fucking up but what you said is true too.","859164904628080640",https://twitter.com/EvvyKube/status/859164904628080640
victoriablythe,2017-05-01 17:56,0,"I 'll say it again. You can't make this stuff up . https:// twitter.com/kylegriffin1/s tatus/859030124708212741 …","859164559956824064",https://twitter.com/victoriablythe/status/859164559956824064
SlimeSeason7,2017-05-01 17:55,0,"I just can't believe the racial/cultural make up of the people on this island","859164362975531008",https://twitter.com/SlimeSeason7/status/859164362975531008
EncouragerVRM,2017-05-01 17:50,0,"You can't even make this ish up . This is your leader. I didn't for em. http:// fb.me/7bAoErOKI","859163165485039617",https://twitter.com/EncouragerVRM/status/859163165485039617
jasminesabido,2017-05-01 17:43,0,"i can't make this up","859161257416552449",https://twitter.com/jasminesabido/status/859161257416552449
BWJtanner,2017-05-01 17:31,0,"I can't even make this shit up","859158441872457728",https://twitter.com/BWJtanner/status/859158441872457728
Jus_BeYOUtiful,2017-05-01 17:29,0,"i 'm so proud of my brother man i can't make this up !!","859157816954769409",https://twitter.com/Jus_BeYOUtiful/status/859157816954769409
Shaun_Johntwg,2017-05-01 17:24,0,"You know it come with that stamp right. I can't make this shit up . I done even have to write it #mmm","859156705418063872",https://twitter.com/Shaun_Johntwg/status/859156705418063872
thephilishere,2017-05-01 17:24,0,"#KevinHart coming to Philly to discuss new book ' I Can't Make This Up : Life Lessons' http://www. phillyvoice.com/kevin-hart-com ing-to-philly-to-discuss-new-book-i-cant-make-this-up-life-lessons/?utm_campaign=pv-site&utm_medium=twitter&utm_source=dlvr.it … pic.twitter.com/L7w4uD9MQk","859156541483622400",https://twitter.com/thephilishere/status/859156541483622400
sineadpatrice,2017-05-01 17:21,1,"Kevin Hart coming to Philly to discuss new book " I Can't Make This Up : Life Lessons" http://www. phillyvoice.com/kevin-hart-com ing-to-philly-to-discuss-new-book-i-cant-make-this-up-life-lessons/ … pic.twitter.com/BrHeal6fgi","859155858151878656",https://twitter.com/sineadpatrice/status/859155858151878656
WriterWarrior,2017-05-01 17:21,0,"You can't make this stuff up . Second Couples-n-Coffee Over Twitter Convo I 've missed this year. https:// twitter.com/ashedryden/sta tus/859088474879795200 …","859155848572133376",https://twitter.com/WriterWarrior/status/859155848572133376
dcbat,2017-05-01 17:20,0,"You can't make this stuff up ! I can envision the SNL skit now! http:// wapo.st/2pOL1yk?tid=ss _tw …","859155503389265921",https://twitter.com/dcbat/status/859155503389265921
1shanaluv,2017-05-01 17:17,1,"Why would he make it up you stupid AZZ witch this get a STFU you're not helping I can't with her it's not about you Sam use your brain","859154726335594496",https://twitter.com/1shanaluv/status/859154726335594496
TheXenium,2017-05-01 17:14,0,"Well I definitely just spilled Mountain Dew on my router. I can't make this up","859154064319361029",https://twitter.com/TheXenium/status/859154064319361029
mssenator,2017-05-01 17:07,0,"I can never get enough @Crimetown can you? http:// Crimetown.com You can't make this stuff up . I should know.","859152330159271942",https://twitter.com/mssenator/status/859152330159271942
iamHaroldJames,2017-05-01 17:07,0,"I can't make this stuff up https:// twitter.com/STFUWhenI_Twee t/status/858827164199915521 …","859152327936290817",https://twitter.com/iamHaroldJames/status/859152327936290817
danlettt,2017-05-01 16:57,0,"i can't even make this up . My mom just asked "Dan, is that band NWA going to be at your concert in Florida? I 'm not sure if I like them"","859149928395931653",https://twitter.com/danlettt/status/859149928395931653
taraturnbull,2017-05-01 16:57,0,"I SO wish this was #fakenews you can't even make this stuff up !!! https:// twitter.com/cnnbrk/status/ 859130384772149250 …","859149731272019968",https://twitter.com/taraturnbull/status/859149731272019968
AceDJay_,2017-05-01 16:45,0,"I can't make this up","859146893477150720",https://twitter.com/AceDJay_/status/859146893477150720
AceSoSerious,2017-05-01 16:38,0,"Those same girls apologized and see me and give me big fake hugs #storytime I can't make this up","859145017700605952",https://twitter.com/AceSoSerious/status/859145017700605952
sb14121991,2017-05-01 16:35,7,"So proud of my wife @jayletay for managing to make it to our first dance. I can't watch this without tearing up . #InspiringStories #fighter pic.twitter.com/E9A1I9EYrQ","859144229054025728",https://twitter.com/sb14121991/status/859144229054025728
uglyinperson__,2017-05-01 16:21,2,"I can't make this up https:// twitter.com/kayviva_/statu s/859135604478492672 …","859140691993251841",https://twitter.com/uglyinperson__/status/859140691993251841
jaye_brown1,2017-05-01 16:19,0,"So they are playing policeman. One needs a pillow so they can be the fat policeman. I can't make this stuff up . 2/2","859140186927751169",https://twitter.com/jaye_brown1/status/859140186927751169
_KiiGetHer,2017-05-01 16:15,0,"I really can't make this up","859139285827686400",https://twitter.com/_KiiGetHer/status/859139285827686400
Real_KR_Xox,2017-05-01 16:11,0,"I can't make this stuff up pic.twitter.com/8c7YQcvza1","859138123057557504",https://twitter.com/Real_KR_Xox/status/859138123057557504
zondrawilson,2017-05-01 15:59,0,"You can't make this stuff up ! I 'm so embarrassed for this country!","859135289641451520",https://twitter.com/zondrawilson/status/859135289641451520
issaravenbird,2017-05-01 15:53,0,"girl I can't make this shit up lol","859133620711280642",https://twitter.com/issaravenbird/status/859133620711280642
Han_coop,2017-05-01 15:50,0,"I can't even make this shit up . I was bugging","859132820266135552",https://twitter.com/Han_coop/status/859132820266135552
Razor_Dibs,2017-05-01 15:39,0,"IT'S SNOWING IN MINNESOTA I CAN'T MAKE THIS UP !!!","859130249744928768",https://twitter.com/Razor_Dibs/status/859130249744928768
KushFruit,2017-05-01 15:39,0,"Can't make it up . This Twitter shyt got deep. I was gonna stay still but nah, I 'm here","859130074376941568",https://twitter.com/KushFruit/status/859130074376941568
Lola_Bunni,2017-05-01 15:18,0,"I can't make this shit up","859124850828472320",https://twitter.com/Lola_Bunni/status/859124850828472320
HimDownstrz,2017-05-01 15:15,0,"I assume you are a credible news source and you can't make this up . https:// twitter.com/complexsports/ status/610553108922548224 …","859124208361754624",https://twitter.com/HimDownstrz/status/859124208361754624
FereshtaKazemi,2017-05-01 15:09,0,"U can't make this stuff up if u tried! "My wife’s put me on a tofu & raw vegetable diet, and I couldn’t take it anymore" https:// twitter.com/fereshtakazemi /status/859122246320836609 …","859122723641012224",https://twitter.com/FereshtaKazemi/status/859122723641012224
micahleigh13,2017-05-01 14:59,0,"and then I KID U NOT, I LITERALLY saw a squirrel as I walked back to my car !!! i can't even make this stuff up !!! https:// twitter.com/micahleigh13/s tatus/859119984848629760 …","859120136493641728",https://twitter.com/micahleigh13/status/859120136493641728
Humor__Books,2017-05-01 14:59,0,"#4: I Can't Make This Up : Life Lessons: I Can't Make This Up : Life Lessons by Kevin Hart… https:// goo.gl/fb/EkCkVI #Humor #Audiobooks","859119996118716420",https://twitter.com/Humor__Books/status/859119996118716420
edmeyer_able,2017-05-01 14:55,1,"On the day that @potus declared #LoyaltyDay2017 trump says " I don't stand by ANYTHING " you can't make this up http:// freakoutnation.com/2017/05/watch- trump-makes-a-fool-of-himself-over-obama-wiretap-claims-again-abruptly-ends-interview/ …","859119157450821633",https://twitter.com/edmeyer_able/status/859119157450821633
KnoxofAZ,2017-05-01 14:54,0,"AGAIN, I can't make this stuff up ! This guy is an absolute s*** show! https:// twitter.com/CBSNews/status /859019067541389314 …","859118884367941636",https://twitter.com/KnoxofAZ/status/859118884367941636
VicMRodriguez,2017-05-01 14:54,0,"i always bring this up , but it's like they can't wait to make POCs villains. even Tamir Rice had his dad's history dragged out.","859118872187867138",https://twitter.com/VicMRodriguez/status/859118872187867138
JT_Jag,2017-05-01 14:51,0,"So the fucked up thing is I wanna make fun of this But I can't : I 've eaten at McDonalds, I know their fries, this is prob. functional https:// twitter.com/NBCNews/status /859114944427683840 …","859118150792732674",https://twitter.com/JT_Jag/status/859118150792732674
JohnBanther,2017-05-01 14:49,0,"I don't take sides, but you just can't make stuff like this up ! https:// twitter.com/lauren_souther n/status/859021070342508545 …","859117675838091264",https://twitter.com/JohnBanther/status/859117675838091264
thegaryhicks,2017-05-01 14:49,0,"Im the biggest PG guy there is, he turned it up the last month of the season, can't do that and expect to make all NBA. I 'm good with this","859117590182060032",https://twitter.com/thegaryhicks/status/859117590182060032
RLJ1738,2017-05-01 14:46,0,"Bruh I can't make this kinda shit up","859116716084916229",https://twitter.com/RLJ1738/status/859116716084916229
thiccxen,2017-05-01 14:44,0,"| Hi, I 'm this writer and I change characters a lot. Probably make people mad because I can't make up my mind. Right?","859116233215668225",https://twitter.com/thiccxen/status/859116233215668225
heyitsbkay,2017-05-01 14:40,0,"People really love to hate on MU. I can't make this stuff up .","859115424708997122",https://twitter.com/heyitsbkay/status/859115424708997122
AaronLMGoodwin,2017-05-01 14:21,1,"You know the type, the people who use " I just *feel* I should/shouldn't do this " as an excuse for when they can't make up they damn mind?","859110586705104897",https://twitter.com/AaronLMGoodwin/status/859110586705104897
__crdi,2017-05-01 14:19,3,"I honestly can't believe I 've lied well enough up to this point to make people believe I 'm capable of functioning in the real world","859110095116009472",https://twitter.com/__crdi/status/859110095116009472
AndrewPikus,2017-05-01 14:12,1,"I can't wait to get on the Wake up Make money Workout Hang with friends Sleep Routine this summer","859108304018169856",https://twitter.com/AndrewPikus/status/859108304018169856
Mandamonium_,2017-05-01 14:06,2,"Guys... welcome to the shit show that is my life. I can't make this shit up","859106707045318657",https://twitter.com/Mandamonium_/status/859106707045318657
Delewis_,2017-05-01 14:05,0,"My house going be lit everyday I can't make this up lol","859106411233595392",https://twitter.com/Delewis_/status/859106411233595392
SteveQuinn19,2017-05-01 14:02,0,"With all this rain, I can't make up my mind whether to stock the backyard with trout or bass","859105887000162305",https://twitter.com/SteveQuinn19/status/859105887000162305
AyeisforAshley,2017-05-01 13:58,0,"".....but anyways it's a beautiful day today I 'm gonna take my friend to tacos, where should we go?" I can't make this up","859104868677672961",https://twitter.com/AyeisforAshley/status/859104868677672961
ashleytearra,2017-05-01 13:57,2,"@KevinHart4real Will Release Debut Book, " I Can't Make This Up : Life Lessons"... (via @parlemag ) https://www. parlemag.com/2017/04/kevin- hart-book-life-lessons/ …","859104614817333250",https://twitter.com/ashleytearra/status/859104614817333250
samhodde,2017-05-01 13:55,0,"My rebooked flight was oversold. I can't make this up . #SamStillInTOR","859104087626985473",https://twitter.com/samhodde/status/859104087626985473
jaydennaussia,2017-05-01 13:53,1,"I can't make this up","859103602773827584",https://twitter.com/jaydennaussia/status/859103602773827584
Turntablez,2017-05-01 13:50,0,"My favorite line ... “ I don’t stand by anything." You just can't make this kind of stupidity up !","859102727628091392",https://twitter.com/Turntablez/status/859102727628091392
Wild100sOwn,2017-05-01 13:45,0,"I can't make this up http:// fb.me/15PTgnl4d","859101485736628226",https://twitter.com/Wild100sOwn/status/859101485736628226
Love_kayx3,2017-05-01 13:43,0,"The shit I get myself into. I swear, I can't make this shit up .","859100886622232577",https://twitter.com/Love_kayx3/status/859100886622232577
adamreidsmith,2017-05-01 13:31,0,"Trump today asked why The Civil War couldn't have just been talked out. I mean you can't make this sh*t up anymore. 'Farce' doesn't cut it.","859097929461714946",https://twitter.com/adamreidsmith/status/859097929461714946
gnimie,2017-05-01 13:27,0,"You can't make this shit up . I wish it was made up .","859096919737499649",https://twitter.com/gnimie/status/859096919737499649
MarjiAnn,2017-05-01 13:25,0,"I can't even make this up ...TheMarge88 https:// twitter.com/homage/status/ 859045329148276736 …","859096440894877698",https://twitter.com/MarjiAnn/status/859096440894877698
realjoegino5,2017-05-01 13:23,0,"I just see "Hate" when they say that shit I can't make this shit up","859095931764998144",https://twitter.com/realjoegino5/status/859095931764998144
rvzellewilson,2017-05-01 13:21,0,"I can't make this up ... @RashadKannabis up next! [click the link in his bio] #NewMusicAlert https://www. instagram.com/p/BTjtSAYgXf4/","859095534522466304",https://twitter.com/rvzellewilson/status/859095534522466304
Laid_Back_Melo9,2017-05-01 13:20,0,"Women rationale because I know, or I 'm always right I can't make this Shit up","859095144833921030",https://twitter.com/Laid_Back_Melo9/status/859095144833921030
Sin4Vik,2017-05-01 13:19,0,"He just asked why a child was @a party? I can't make this up . Guess we can't go to parties until we're 18. White ppl said so. https:// twitter.com/alanmzibelman/ status/859084559874498560 …","859094989271425024",https://twitter.com/Sin4Vik/status/859094989271425024
Jasketball,2017-05-01 13:10,1,"Really about to level up on everyone this summer I can't wait to leave the lames behind and only make moves with the mob","859092622945726465",https://twitter.com/Jasketball/status/859092622945726465
celestialclocks,2017-05-01 13:06,0,"You can't make this up . Truly. I laughed out loud although the concept is intriguing: https:// twitter.com/nowthisnews/st atus/859019579904802816 …","859091672273227779",https://twitter.com/celestialclocks/status/859091672273227779
judithgiana,2017-05-01 13:06,0,"And then he said “ I wasn’t aware you can’t just break up big banks. My bad.” Can’t make this stuff up .","859091564240531456",https://twitter.com/judithgiana/status/859091564240531456
Heyycandy,2017-05-01 13:02,0,"can't make this stuff up lol i 'm trying to find out if this is serious or not pic.twitter.com/kat1rYj0hV","859090777980448769",https://twitter.com/Heyycandy/status/859090777980448769
SimplyYours_Joh,2017-05-01 13:01,0,"Jamaicans at war I can't make this shit up . http://www. dailymotion.com/video/x3vvz38_ if-a-jamaican-was-in-a-war_fun …","859090375495081984",https://twitter.com/SimplyYours_Joh/status/859090375495081984
GEORGESKRAIT,2017-05-01 12:59,10,"i can't make this shit up pic.twitter.com/WifU6ep7u3","859089951773925376",https://twitter.com/GEORGESKRAIT/status/859089951773925376
julia_hulia03,2017-05-01 12:52,1,"One of my coworkers literally faked being temporarily blind to go home early lol I can't even make this up","859088241311588352",https://twitter.com/julia_hulia03/status/859088241311588352
robmclaughlin13,2017-05-01 12:48,0,"You can't make this stuff up . I 'm on my way to the viewing for my cousin who was killed last Thursday when... http:// fb.me/1ZxqnFoNV","859087103413690368",https://twitter.com/robmclaughlin13/status/859087103413690368
Angelia007,2017-05-01 12:47,0,"Like I literally can't make this shit up . My bro sent me the screen shots this morning. What a Monday!","859086782331277314",https://twitter.com/Angelia007/status/859086782331277314
kreepaleeks,2017-05-01 12:43,0,"yeah mane, that's kreepa. i can't have this nigga firing me up for crying you just gotta keep yo head up . make him proud.","859085925674082306",https://twitter.com/kreepaleeks/status/859085925674082306
FrenchhBread,2017-05-01 12:42,0,"Y'all just make up all these extra ass rule so you can't lose. I 'm pretty sure this shit isn't in the rule book lol","859085664729616386",https://twitter.com/FrenchhBread/status/859085664729616386
mjk_4mjk,2017-05-01 12:41,2,"Can you come up with anything, that remotely makes this make sense? I can't .","859085375402385410",https://twitter.com/mjk_4mjk/status/859085375402385410
EverythingSlim,2017-05-01 12:36,0,"Now y'all I got sent an essay at least 2 pages of how this guy would please me & it was LONG AS FUCK .. I can't make this stuff up ...","859084096592527360",https://twitter.com/EverythingSlim/status/859084096592527360
fkgator,2017-05-01 12:36,2,""Civil War" #AndrewJackson every time I think "you just can't make this s**t up ", @realDonaldTrump comes up with another mortifying comment","859084040560926722",https://twitter.com/fkgator/status/859084040560926722
SharonAll_In,2017-05-01 12:33,0,"Yep.. can't make this sh*t up ! And you can't unhear it either. I retweeted the audio clip of his latest mind sludge with a warning.","859083302711377920",https://twitter.com/SharonAll_In/status/859083302711377920
campaignunique,2017-05-01 12:24,0,"lol endia day was t'd I can't make this up","859081036889829376",https://twitter.com/campaignunique/status/859081036889829376
DoubleStraps,2017-05-01 12:24,0,"This is why I can't get in on jacobin's bullshit focus on the white working class, since we don't make up the majority of the working class.","859081034448633858",https://twitter.com/DoubleStraps/status/859081034448633858
ZeeksPlace,2017-05-01 12:23,0,"oh hell yeah! I can't wait for the belligerent cover ups spicer has to make up today for this nugget... i 'd call in a sick day if I was him","859080892966293505",https://twitter.com/ZeeksPlace/status/859080892966293505
_almightymt,2017-05-01 12:20,0,"I swear I can't make this shit up boi in my (Poo voice ) THE DIARY OF MY MUSIC 5/19/2017… https://www. instagram.com/p/BTjmRxElJuN/","859080140034379776",https://twitter.com/_almightymt/status/859080140034379776
the_real_dgraz,2017-05-01 12:19,0,"I mean, you can't even make this shit up . https:// twitter.com/lackinggrit/st atus/859079261260533761 …","859079816183676929",https://twitter.com/the_real_dgraz/status/859079816183676929
Capes26,2017-05-01 12:17,0,"Carly just referred to her nostrils as nose buds I can't make this shit up","859079340579008513",https://twitter.com/Capes26/status/859079340579008513
AllisonGrey,2017-05-01 12:09,0,"If he were smart, he could make this fucked up argument better, so I don't think he is doing this because he is smart, I think he can't not.","859077449304260608",https://twitter.com/AllisonGrey/status/859077449304260608
ariennaminx,2017-05-01 12:07,0,"I 'm mad tired.... I can't be staying up late like this so often anymore, I won't make it to 30","859076776324087809",https://twitter.com/ariennaminx/status/859076776324087809
HNICPablo100,2017-05-01 11:52,0,"Greg Hit Her I Did The Next Day On My Brother I Can't Make This Shit Up","859072953706848260",https://twitter.com/HNICPablo100/status/859072953706848260
STONECOLD_JET,2017-05-01 11:51,1,"I can't make this up","859072684935847936",https://twitter.com/STONECOLD_JET/status/859072684935847936
Jerimiahisaiah,2017-05-01 11:44,1,"Like, 2014-2015 was the year I was alone on this shit. I can't be alone this time, y'all gonna have to speak up to make it more clear.","859070984195846144",https://twitter.com/Jerimiahisaiah/status/859070984195846144
LibsAreMoochers,2017-05-01 11:43,0,"Can't make this stuff up - I guess all that white 'global warming' stuff got in the way-Breitbart http:// bit.ly/2oPiuss via @BreitbartNews","859070815219965953",https://twitter.com/LibsAreMoochers/status/859070815219965953
Kimsoillove,2017-05-01 11:43,0,"OMG! Graduation is happening and I can't make it stop or slow down so that I can catch up ! Why is this such a... http:// fb.me/8G0Ywzvoc","859070805656948736",https://twitter.com/Kimsoillove/status/859070805656948736
JessicaMescall,2017-05-01 11:41,2,"I don't know how to make this picture not-upside-down (down-side- up ...?) in case you can't tell, it's pizza. pic.twitter.com/xxIdo4zgnP","859070263270547456",https://twitter.com/JessicaMescall/status/859070263270547456
