_TheeREALMe,2017-04-30 00:45,0,"Pandora jamming tonight.. I can't make this up !","858542860492308480",https://twitter.com/_TheeREALMe/status/858542860492308480
HelloQueendom,2017-04-30 00:39,0,"I had a professor assign a three page paper....asking us to write about how we wrote a previous three page paper. I can't make this up .","858541406805217282",https://twitter.com/HelloQueendom/status/858541406805217282
_itsjusstati,2017-04-30 00:34,0,"At this point I give up .... can't keep trying to make something happen, just have to let it happen on its own","858539948844224512",https://twitter.com/_itsjusstati/status/858539948844224512
jimdawg,2017-04-30 00:14,0,"I 'm so happy I grew up in the 70's and 80's. Why can't they make movies like this anymore?!!! http:// fb.me/5epZQlkto","858535019282931713",https://twitter.com/jimdawg/status/858535019282931713
MikeAlssid,2017-04-30 00:11,0,"I 'm infuriated. This was THE GAME to win (3-0 up ). Can't believe it. Ruined my night. Hopefully Spurs make me happy tomorrow","858534350891225090",https://twitter.com/MikeAlssid/status/858534350891225090
_Tybz,2017-04-30 00:07,0,"Sharaine I can't make this up man lol","858533267363975168",https://twitter.com/_Tybz/status/858533267363975168
Mommii2_D,2017-04-29 23:57,0,"This bitch Breasia so funny I can't make this up","858530772327817216",https://twitter.com/Mommii2_D/status/858530772327817216
IamNoJoke,2017-04-29 23:55,18,"As you can see... This is Generational Thoting at its best... And I know Granny is Looking down so proud can't make this shit up pic.twitter.com/i8msfmYVFh","858530184743538688",https://twitter.com/IamNoJoke/status/858530184743538688
_TEEboss,2017-04-29 23:51,2,""Man it be so funny dawg, when ya haters team up !" I can't make this up ... @MoneyBaggYo https:// twitter.com/sextmaraj/stat us/858124547954028544 …","858529305114140675",https://twitter.com/_TEEboss/status/858529305114140675
_tae2187,2017-04-29 23:44,1,"I can't make this up https:// twitter.com/_hefner6/statu s/858527474656960513 …","858527527182229509",https://twitter.com/_tae2187/status/858527527182229509
oscardontlike,2017-04-29 23:36,0,"I work with the dude that invented the stanky leg. I can't make this shit up","858525366843052032",https://twitter.com/oscardontlike/status/858525366843052032
China0613,2017-04-29 23:34,0,"#LivePD I 'm in love. #LivePD is http:// thebomb.com Favorite new reality show. An actual reality show. You can't make this stuff up lol","858525060495269888",https://twitter.com/China0613/status/858525060495269888
MeYouANDfashion,2017-04-29 23:31,0,"I can't make this up ..","858524105062182914",https://twitter.com/MeYouANDfashion/status/858524105062182914
kenyattaaa,2017-04-29 23:27,1,"You Niggas Be Sick And I Can't Make This Up","858523268042633216",https://twitter.com/kenyattaaa/status/858523268042633216
Jarryakeem,2017-04-29 23:26,0,"I can't make this up","858523009623216128",https://twitter.com/Jarryakeem/status/858523009623216128
SierraStine15,2017-04-29 23:21,1,"I can't make this up","858521598504173569",https://twitter.com/SierraStine15/status/858521598504173569
CassRaeC,2017-04-29 23:14,0,"I love when people in tv or movies says "you can't make this stuff up !" Well someone made it up so....","858519838527963136",https://twitter.com/CassRaeC/status/858519838527963136
Itaku,2017-04-29 22:59,0,"I 'm throwing my own party with open bar and live band at a convention. I can't make this shit up . Fado Irish Pub. #DHATX17","858516227668549632",https://twitter.com/Itaku/status/858516227668549632
Rolypoly07,2017-04-29 22:54,0,"I swear haha I can't make this shit up","858514881548619779",https://twitter.com/Rolypoly07/status/858514881548619779
xxuelie,2017-04-29 22:53,263,"IM STILL LAUGHING OVER THIS SCENE yixing who had smokey eye make up on and he was embarrassed being on stage omg i can't so cute pic.twitter.com/0Xxu33fAG2","858514666510704641",https://twitter.com/xxuelie/status/858514666510704641
VerbaAqua14,2017-04-29 22:51,0,"Wellllll.... c'mon! I mean, elephants, Rome (circa the time it *deported 40K Ligurians* - can't make this shit up !!)... https:// twitter.com/WildeThingy/st atus/858507598273933314 …","858514091203284992",https://twitter.com/VerbaAqua14/status/858514091203284992
kbobcat05,2017-04-29 22:48,0,"#Different part of #town ... guy talking to girl. "Damn near broke my leg when I slipped chasing that TADPOLE!" Can't make this stuff up .","858513391446609920",https://twitter.com/kbobcat05/status/858513391446609920
mskaelyn486,2017-04-29 22:47,0,"This motherfucker proposed to his mistress while he was still married. I can't make this shit up . #FatalProphet","858513001233690624",https://twitter.com/mskaelyn486/status/858513001233690624
timgunter,2017-04-29 22:42,0,"Plot twist: she is now my waiter at Cheesecake Factory. You can't make this shit up . I 'm pretty sure we live in a simulation","858511914221031424",https://twitter.com/timgunter/status/858511914221031424
GotDamnLonzo,2017-04-29 22:42,1,"I can't make this up lmao","858511882403106817",https://twitter.com/GotDamnLonzo/status/858511882403106817
ESZ_CoreyP,2017-04-29 22:40,0,"@DGO23_ can't wait to see where you end up . I know you'll make an impact on an NFL team this year","858511236513886208",https://twitter.com/ESZ_CoreyP/status/858511236513886208
alidwyer_,2017-04-29 22:34,0,"I get to the bar and a glass of rosé immediately gets spilled on me y'all I can't make this shit up this is too much I can't help but laugh","858509857275641857",https://twitter.com/alidwyer_/status/858509857275641857
kyleejsmith,2017-04-29 22:30,0,"You guys Kale is in Walmart right now getting stuff to make me French toast for breakfast. I can't even make this up , I 'm this lucky.","858508881147957249",https://twitter.com/kyleejsmith/status/858508881147957249
jennpage_89,2017-04-29 22:09,0,"I can't make this up ! She's under the blanket. #shethinkssheshuman https://www. instagram.com/p/BTfgG7pj2Tx/","858503618420514817",https://twitter.com/jennpage_89/status/858503618420514817
OhLuLaLove,2017-04-29 22:05,0,"I can't make this up . Rental car upgrade #lularoe #orlandointernationalairport … https://www. instagram.com/p/BTffooVDDWT/","858502578266615809",https://twitter.com/OhLuLaLove/status/858502578266615809
iMA_PARTYBOY,2017-04-29 21:58,0,"I Can't Make This Up #PLAY Already Lit ASF .... T. I PERFORMING LIVE #HUSTLEGANGTOUR @Play… https://www. instagram.com/p/BTfexdrA9v3/","858500683951202305",https://twitter.com/iMA_PARTYBOY/status/858500683951202305
MotoKitten99,2017-04-29 21:54,0,"You just can't make this kind of stupidity go away...and I sure wish I was making it up . #theleftisnotright pic.twitter.com/u93kkfFt5d","858499753902034944",https://twitter.com/MotoKitten99/status/858499753902034944
smoke_g100it,2017-04-29 21:48,0,"I can't make this up #TheOne http://www. instagram.com.ln.is/6wD3o","858498146757996544",https://twitter.com/smoke_g100it/status/858498146757996544
gene14800846,2017-04-29 21:45,0,"Go figure. First time all year I didn't have Harrison on my team and he bags 2. Can't make this stuff up . Good for my real team though.","858497581273550849",https://twitter.com/gene14800846/status/858497581273550849
TRU_PlayerFR,2017-04-29 21:43,0,"My Girlfriend look like Lauren London I can't make this up .....","858496882624126976",https://twitter.com/TRU_PlayerFR/status/858496882624126976
DatBawse,2017-04-29 21:35,0,"Here's the deal kid, You make grandma mad, you dun fucked up . You're on your own. I can't help you this time. Me to DJ.","858495106508136448",https://twitter.com/DatBawse/status/858495106508136448
mia_jene,2017-04-29 21:29,1,"I can't make this sh*t up #selfienation #momselfie pic.twitter.com/bhD0Zfb2ig","858493576157810689",https://twitter.com/mia_jene/status/858493576157810689
JillCSN,2017-04-29 21:25,2,"Cullen blocks Shattenkirk shot, wins the battle for the puck and scores the short handed goal. I can't make this up . 1-0 Pens","858492389949939713",https://twitter.com/JillCSN/status/858492389949939713
BrittanyVenti,2017-04-29 21:22,41,"I 'm a room away from normieies they just praised Bill Nye's show and are now watching Rick and Morty You can't make this shit up pic.twitter.com/nwG7Ru8LSn","858491671620747264",https://twitter.com/BrittanyVenti/status/858491671620747264
4evaElleBelle,2017-04-29 21:22,0,"Sooo my dad just told me he sends nudes to women. I can’t make this stuff up","858491662074613761",https://twitter.com/4evaElleBelle/status/858491662074613761
makeup_by_sammy,2017-04-29 21:15,0,"My favorite liquid make up foundation I have two for when this one runs out can't get enough of this @LAColorsusa pic.twitter.com/5viC6CwDrU","858490040917397505",https://twitter.com/makeup_by_sammy/status/858490040917397505
imiles816,2017-04-29 21:14,0,"I can't make this up ..,","858489775522816000",https://twitter.com/imiles816/status/858489775522816000
Toxin_MUT,2017-04-29 21:13,0,"I . Can't . Make . This . Shit. Up . FUCK AROLDIS BRO THATS THREE FUCKING GAMES IN A FUCKING ROW HE SUCKS pic.twitter.com/eB7J50SE3W","858489328066072581",https://twitter.com/Toxin_MUT/status/858489328066072581
furiousStyles40,2017-04-29 21:04,0,"Nonchalant,confident big man ... I can't make this up","858487244188942336",https://twitter.com/furiousStyles40/status/858487244188942336
Aleishaaa__,2017-04-29 20:53,0,"Like I can't make this shit up . I 'm fucking terrified right now","858484310139179008",https://twitter.com/Aleishaaa__/status/858484310139179008
YungJedii,2017-04-29 20:46,0,"man i can't make this shit up","858482774096977924",https://twitter.com/YungJedii/status/858482774096977924
AzureAceHD,2017-04-29 20:41,0,"You literally can't make this shit up . I swear to god if they make a character with a Leek pun I will actually kill myself xD","858481505840099328",https://twitter.com/AzureAceHD/status/858481505840099328
canadianlynx1,2017-04-29 20:39,1,"lol RT @bbrannan : Ya can’t make this stuff up : a package I have leaving Hong Kong left from “Chek Lap Kok”. #thingsthatsounddirtybutarent","858480811116462080",https://twitter.com/canadianlynx1/status/858480811116462080
bbrannan,2017-04-29 20:37,0,"Ya can’t make this stuff up : a package I have leaving Hong Kong left from “Chek Lap Kok”. #thingsthatsounddirtybutarent","858480504651304960",https://twitter.com/bbrannan/status/858480504651304960
ithrewThaParty,2017-04-29 20:26,0,"I can't make this up tho","858477726587658240",https://twitter.com/ithrewThaParty/status/858477726587658240
TaraTNA,2017-04-29 20:22,0,"I can't make this shit up , it's hard to tell me shit when I 'm not eating because of you, I 'm eating whatever I want because of me #foh","858476586177363968",https://twitter.com/TaraTNA/status/858476586177363968
MitchThomas17,2017-04-29 20:17,1,"You can't make this stuff up . Terrible luck for a team that desperately needs something positive. I hate everything. #NHLDraftLottery https:// twitter.com/craigsmorgan/s tatus/858474052507152384 …","858475286278438912",https://twitter.com/MitchThomas17/status/858475286278438912
Catie_Wallace17,2017-04-29 20:14,0,"i just saw a girl wearing a pink juicy tracksuit. i can't make this up y'all.","858474507706781696",https://twitter.com/Catie_Wallace17/status/858474507706781696
_its_OT_,2017-04-29 20:12,0,""Blacks for Trump. I like that guy." Can't make this shit up #alternativefacts","858474180299370496",https://twitter.com/_its_OT_/status/858474180299370496
DuhDarianne,2017-04-29 20:12,1,"Someone came into the hospital with their child named 'shedidanasty'... I can't make this shit up .","858474170958716929",https://twitter.com/DuhDarianne/status/858474170958716929
runaroundraq,2017-04-29 20:07,0,"You guys, I can't make this shit up pic.twitter.com/q5iRkbclBi","858472776977362944",https://twitter.com/runaroundraq/status/858472776977362944
chloebuddx,2017-04-29 19:56,0,"No you can't have a winged liner for this shoot because I 'm a make up artist with broken hands","858470121051914241",https://twitter.com/chloebuddx/status/858470121051914241
digitalbuttplug,2017-04-29 19:52,0,"Grandma: Do the guys play with themselves online? Me: Yeah they do. Grandma: I wanna see. I can't make this shit up people","858468970680143872",https://twitter.com/digitalbuttplug/status/858468970680143872
ThisGui,2017-04-29 19:36,1,"lol I can't make this stuff up","858465062314496000",https://twitter.com/ThisGui/status/858465062314496000
HoLla_Phamous,2017-04-29 19:35,0,"I can't make this up #OzioDayTrip #usualsuspectzdc https://www. instagram.com/p/BTfOgNiAjdK/","858464909520236544",https://twitter.com/HoLla_Phamous/status/858464909520236544
annamtetro,2017-04-29 19:26,0,"I can't make this shit up . Sorry. We have 2 learn cause or wisdom of our struggle to dissolve it. 5/6th chakra burn wrongs w/ true knowledge","858462574635102208",https://twitter.com/annamtetro/status/858462574635102208
CRTT__,2017-04-29 19:20,0,"I deadass can't make this up .","858461000093315073",https://twitter.com/CRTT__/status/858461000093315073
vinsmokesanjis,2017-04-29 19:15,0,"Imagine being this gorgeous without make up . I can't relate. pic.twitter.com/JVSjKA3tJm","858459860031221761",https://twitter.com/vinsmokesanjis/status/858459860031221761
guttagirldior,2017-04-29 19:00,0,"I 'm in rare I can't make this shit up","858456092044644352",https://twitter.com/guttagirldior/status/858456092044644352
deonte_chosen1,2017-04-29 18:58,1,"Fun Fact: Women cheat more than men.. I can't make this up","858455521917120512",https://twitter.com/deonte_chosen1/status/858455521917120512
birgerrhenman,2017-04-29 18:56,2,"Våldtäktsmän och terrorister välkomnas av vänstern OCH alliansen.. You can't make this shit up .. Finns det inga vuxna i Stockholm? pic.twitter.com/9K77iXGQpJ","858454983993286656",https://twitter.com/birgerrhenman/status/858454983993286656
NoLeHacex3,2017-04-29 18:53,1,"I can't make this shit up pic.twitter.com/ofNPjUFaY6","858454176044638209",https://twitter.com/NoLeHacex3/status/858454176044638209
reezus_,2017-04-29 18:50,0,"I can't make this up","858453447854764036",https://twitter.com/reezus_/status/858453447854764036
guitarded71,2017-04-29 18:47,0,"@NHL ...you can't make this shit up . This is disgusting. And I 'm not a fan of either team. A shameful display.","858452632989519873",https://twitter.com/guitarded71/status/858452632989519873
1Kelleybrew,2017-04-29 18:45,0,"Read the whole story, it's all facts! I can't make this up , I would screenshot her page but I ain't like that https:// twitter.com/cambria6531012 7/status/858451956611727364 …","858452091181961216",https://twitter.com/1Kelleybrew/status/858452091181961216
TreDay_1008,2017-04-29 18:42,0,"I can't make this up https:// twitter.com/sanchezioo/sta tus/858448127682117633 …","858451475088977920",https://twitter.com/TreDay_1008/status/858451475088977920
BrendyJo3,2017-04-29 18:39,3,"Now this just cracked me up ! I mean you can't even make this stuff up !!","858450647045226497",https://twitter.com/BrendyJo3/status/858450647045226497
pestleperson,2017-04-29 18:31,0,"WoW ... Sometimes you just can't make this shit up ...Well you can actually ... I do it all the time ...","858448699759902720",https://twitter.com/pestleperson/status/858448699759902720
mehtaphors1,2017-04-29 18:31,0,"I can't even make this stuff up with this team https:// twitter.com/Connor_J_Hughe s/status/858447399349563392 …","858448673490993152",https://twitter.com/mehtaphors1/status/858448673490993152
RemedyAKARemi,2017-04-29 18:21,0,"U can't make this up ..The lights Fr just went out in the gym during the hoop game I 'm… https://www. instagram.com/p/BTfGAEuldTJ/","858446215276634115",https://twitter.com/RemedyAKARemi/status/858446215276634115
WarriorStudioss,2017-04-29 18:21,0,"I added a video to a @YouTube playlist http:// youtu.be/o_YX_SV3bH8?a Can't Make This Shit Up","858446205310861312",https://twitter.com/WarriorStudioss/status/858446205310861312
Antsilog,2017-04-29 18:20,0,"EDC line up is fire lol. So sad I can't make it this year...","858445922979561472",https://twitter.com/Antsilog/status/858445922979561472
shabbaINDEIA,2017-04-29 18:04,0,"Cashier was tripping ballsack. I can't make this up .","858441825677398017",https://twitter.com/shabbaINDEIA/status/858441825677398017
JacksonCrane,2017-04-29 17:48,0,"I can't make this stuff up . Mother Nature is confused.","858437973846757376",https://twitter.com/JacksonCrane/status/858437973846757376
arodjaden_angel,2017-04-29 17:34,0,"I know you can't make this shit up","858434316241645568",https://twitter.com/arodjaden_angel/status/858434316241645568
ProfessorMic,2017-04-29 17:28,0,"Bro chicago got me DREAMING about tickets... I woke up came outside and it was a ticket on my car window. I can't make this shit up .","858432925435654145",https://twitter.com/ProfessorMic/status/858432925435654145
jadyn_silva,2017-04-29 17:27,0,"one of those days I can't put make up on... this sucks","858432647864795136",https://twitter.com/jadyn_silva/status/858432647864795136
RUSTY1012000,2017-04-29 17:20,0,"I 'm sorry I can't make this sh_t up pelosi gets dumber by the day!! Shumer must be swapin spit with her! https:// twitter.com/foxnews/status /858140881806741506 …","858430774231441408",https://twitter.com/RUSTY1012000/status/858430774231441408
btsteelcurtain,2017-04-29 17:15,0,"I literally laughed out loud at the last RT...you can't make this stuff up . #Steelers","858429458155532290",https://twitter.com/btsteelcurtain/status/858429458155532290
BigBabaRob,2017-04-29 17:14,0,"@SF_ACE5 Mr. Mayor. I 'm tied up on this urgent reno project. I can't make the trip today. I 'm really sorry. Have a great time. pic.twitter.com/mDA4VBsRuS","858429400265699328",https://twitter.com/BigBabaRob/status/858429400265699328
MoanBrooklyn,2017-04-29 17:14,0,"This is important. I can't make up my mind.","858429329306337281",https://twitter.com/MoanBrooklyn/status/858429329306337281
Shrinkingwendy,2017-04-29 17:06,0,"I so get this ! I 'm socially awkward. Don't know how to make new friends. I 'm kinda shy, but once you get to know me you can't shut me up !lol https:// twitter.com/TheWeirdWorld/ status/858395735607435265 …","858427274529558529",https://twitter.com/Shrinkingwendy/status/858427274529558529
isawthesethings,2017-04-29 17:02,0,"It is a quote from #facist Ayn Rand book "the virtue of selfishness". I kid you not… You can't make this stuff up .","858426266709626880",https://twitter.com/isawthesethings/status/858426266709626880
Kay_2Times_,2017-04-29 16:59,0,"Maaannn I can't do all this make up , I can't wait to take this mess off","858425557486379008",https://twitter.com/Kay_2Times_/status/858425557486379008
GotDamnLonzo,2017-04-29 16:57,0,"Mane I can't make this up lmao","858424960242655232",https://twitter.com/GotDamnLonzo/status/858424960242655232
ManofSmith,2017-04-29 16:56,0,"I can't make this shit up . It's weird. She even asks about how the store is. If we're busy and other shit. Like whaaaa?","858424793892311040",https://twitter.com/ManofSmith/status/858424793892311040
chrismes11,2017-04-29 16:32,0,"Like the striped overalls, the hat, everything. I can't make this up .","858418709173501953",https://twitter.com/chrismes11/status/858418709173501953
Medi0cre_AtBest,2017-04-29 16:25,0,"I can't make this shit up , these people actually think they are victims. https:// twitter.com/shotsfi1690441 1/status/858415778550484993 …","858416908009443331",https://twitter.com/Medi0cre_AtBest/status/858416908009443331
thomgruhler,2017-04-29 16:01,0,"I can't make this up . Woman: I haven't heard from you in a long time". Reply: because you have a restraining order against me"","858410973303939072",https://twitter.com/thomgruhler/status/858410973303939072
Spencer62708031,2017-04-29 15:42,0,"He told me he loves Brent! I said that why he blocked you. Can't make this up ... pic.twitter.com/SMonVM40Bb","858406085807398912",https://twitter.com/Spencer62708031/status/858406085807398912
BeachWitchMagic,2017-04-29 15:41,1,"I can't make this crap up . How far will Trumpets & GOP go to destroy our constitution & democracy? @foxandfriends you are complicit! #resist https:// twitter.com/foxnews/status /858097715930116096 …","858405909449650176",https://twitter.com/BeachWitchMagic/status/858405909449650176
danijuarezxx,2017-04-29 15:37,0,"Make up apps make me feel like shit cause I can't actually do this look pic.twitter.com/49G7oXPaKS","858404794268094464",https://twitter.com/danijuarezxx/status/858404794268094464
M_R_AmerPatriot,2017-04-29 15:36,0,"I 'd say you can't make this stuff up but someone obviously is, and spreading around like it's real then the lunatics grab it and run!!!","858404582057234433",https://twitter.com/M_R_AmerPatriot/status/858404582057234433
HotMessLinguist,2017-04-29 15:36,0,"I can't make this shit up if I tried pic.twitter.com/TF4r6vOMZ6","858404552650969089",https://twitter.com/HotMessLinguist/status/858404552650969089
GinjaBunaidh,2017-04-29 15:28,0,"I can't make this shit up .","858402602857508864",https://twitter.com/GinjaBunaidh/status/858402602857508864
mmooddle,2017-04-29 15:27,0,"Woman demon crawls out of bed, gets in my face, and says " I took a pussy shit." I can't make this stuff up . #UntoldStoriesofthePsychWard","858402495273500672",https://twitter.com/mmooddle/status/858402495273500672
AyaaaYooo,2017-04-29 15:14,0,"I thought @ILLCapitano94 posted a song called "kill Jane" but I can't find a song called that. Did I make this name up ?!","858399156121067521",https://twitter.com/AyaaaYooo/status/858399156121067521
RioThaGr8,2017-04-29 15:09,0,"I can't make this up ion care for the attention","858397884210974720",https://twitter.com/RioThaGr8/status/858397884210974720
dadawinnin100,2017-04-29 15:04,0,"i 'm a straight fucking kerm now i can't make this shit up","858396711668117504",https://twitter.com/dadawinnin100/status/858396711668117504
haleiga,2017-04-29 15:04,0,"I can't help but prefer high fantasy. Maybe it's because I 'd rather not live in a topsy turvy version of this world, but make up a new one","858396551013642248",https://twitter.com/haleiga/status/858396551013642248
QueenBSanders,2017-04-29 15:02,0,"Just unreal. I was going to say "You can't make this stuff up ."...but @FoxNews has shown me up . #HoldMyBeer","858396163313192961",https://twitter.com/QueenBSanders/status/858396163313192961
LadyTrvlr,2017-04-29 14:58,0,"I 'm half way up . Can't make it to the top. I did good to make it this far. How do I get down? YIKES!!! Oh... http:// fb.me/1V4tS11zf","858395133892493313",https://twitter.com/LadyTrvlr/status/858395133892493313
LadyTrvlr,2017-04-29 14:57,0,"I 'm half way up . Can't make it to the top. I did good to make it this far. How do I get down?… https://www. instagram.com/p/BTeumdxlcpD/","858394865184497664",https://twitter.com/LadyTrvlr/status/858394865184497664
Price1996R,2017-04-29 14:57,0,"Blinding highlight and I 'm so grateful for it @MannyMua733 @JeffreeStar can't do make up without this baby pic.twitter.com/ri4Y9n8bgk","858394847593541632",https://twitter.com/Price1996R/status/858394847593541632
Bashargi,2017-04-29 14:55,0,"Lmao! You can't make this up ! And all the while I thought it was made up https:// twitter.com/fatiskira/stat us/858392644459913216 …","858394438615388161",https://twitter.com/Bashargi/status/858394438615388161
BeingErin,2017-04-29 14:55,0,"When I was done I threw a can of spaghettios at his car then he called me a broke bitch for the spaghettios ... I can't make this up","858394222088642560",https://twitter.com/BeingErin/status/858394222088642560
hannahbrooke00,2017-04-29 14:44,0,"100% serious I looked out my window to see an ostrich walking through my yard. I can't make this stuff up pic.twitter.com/AFEikq6VSp","858391536643579908",https://twitter.com/hannahbrooke00/status/858391536643579908
slayboulevard,2017-04-29 14:42,0,"Every time that we break up we turn around and make up This can't go on now I gotta move on now","858391051643625472",https://twitter.com/slayboulevard/status/858391051643625472
giorno_ebooks,2017-04-29 14:15,0,"also i looked it up apparently bluestacks can't let you skip the two initial downloads so there's really no other way to make this easier","858384233324310528",https://twitter.com/giorno_ebooks/status/858384233324310528
Klassykatee,2017-04-29 14:11,0,"Now she has a magnifying mirror on her trunk and she's doing her makeup.. I can't make this stuff up","858383333419626496",https://twitter.com/Klassykatee/status/858383333419626496
Sherilyons100,2017-04-29 14:07,0,"That's the most ridiculous thing I 've seen in awhile....you can't make this stuff up ....oh, yes they can! https:// twitter.com/Timcast/status /858378914376196096 …","858382231114584065",https://twitter.com/Sherilyons100/status/858382231114584065
OneTongueJohnny,2017-04-29 14:06,0,"You can't make an omelette without smashing a few fragile egos up . Come on Brussels, make my day! Hold my beer while I sort this one out","858382098037657605",https://twitter.com/OneTongueJohnny/status/858382098037657605
WayneSemmens,2017-04-29 14:05,0,"Can't make my mind up what result I want in this Crystal palace Burnley game it's getting tricky swans need a result at old Trafford tho.","858381842768154628",https://twitter.com/WayneSemmens/status/858381842768154628
LovedbyElena,2017-04-29 14:00,0,"What do we think of this ? Can't make up my mind if I love it or if it's a bit childish ? #zaralove #fortheloveofpompoms pic.twitter.com/nsklxqgVce","858380374254268417",https://twitter.com/LovedbyElena/status/858380374254268417
ColdheartedFree,2017-04-29 13:58,0,"Need to hurry up n make this move so I can book me a trip next I can't blow this money wen I need a vacation n more stuff to do...","858380053926875136",https://twitter.com/ColdheartedFree/status/858380053926875136
