Amy_Croce,2017-04-28 10:06,0,"I can't make this up !!!!!!! Is it 5 yet lol","857959283463532544",https://twitter.com/Amy_Croce/status/857959283463532544
imagineddefect,2017-04-28 10:06,0,"i 'll look in my following. i can't make this shit up","857959138801963010",https://twitter.com/imagineddefect/status/857959138801963010
4everNeverTrump,2017-04-28 10:06,6,"I mean, you just can't make this shit up ... https:// twitter.com/johncardillo/s tatus/857956350097326081 …","857959090391138304",https://twitter.com/4everNeverTrump/status/857959090391138304
OneStepGrl,2017-04-28 10:03,0,"Missed you in episode 1 but it seems like you make up for it in coming episodes and I can't wait. This scene is brilliant xx","857958485358727169",https://twitter.com/OneStepGrl/status/857958485358727169
kellie_asmus,2017-04-28 09:54,0,"I can't wait to spend my whole day off tomorrow sleeping to make up for the fact that I was up at 4am every day this week #openingishard","857956147231424514",https://twitter.com/kellie_asmus/status/857956147231424514
kriz_23,2017-04-28 09:37,0,"I feel bad that I can't come this Saturday again. I 'll make it up once I 'm free again @jjerrichogp","857951820986982403",https://twitter.com/kriz_23/status/857951820986982403
1JadedAsh,2017-04-28 09:32,0,"I can't make this shit up .","857950610850811905",https://twitter.com/1JadedAsh/status/857950610850811905
vickybl100,2017-04-28 09:23,5,", @EthanBearman @normangoldman I 'm not sure if I want to laugh or cry. OMG one Can't make this stuff up ! Unreal!!! https:// twitter.com/mattdoucette/s tatus/857315292640313346 …","857948415585419264",https://twitter.com/vickybl100/status/857948415585419264
peterelkind,2017-04-28 09:20,0,"I 'd say 'you can't make this stuff up .' But he does... https:// twitter.com/maggienyt/stat us/857918902902415360 …","857947642768363520",https://twitter.com/peterelkind/status/857947642768363520
_roaaaya,2017-04-28 09:20,1,"I can't make this up smh https:// twitter.com/karenkaykessle r/status/857944653827637248 …","857947529975123969",https://twitter.com/_roaaaya/status/857947529975123969
reallifebrat_,2017-04-28 09:18,0,"lol I can't make this shit up","857947052856270848",https://twitter.com/reallifebrat_/status/857947052856270848
beaubeech02,2017-04-28 09:16,4,"Bruh I can't make this up ! @baebae32 tripped walking across stage at graduation.... kid you not! ask @DMMota22 #StudentOrAthlete","857946700798930944",https://twitter.com/beaubeech02/status/857946700798930944
TransAmandaG,2017-04-28 09:10,0,"I used to say, "You can't make this stuff up ." Clearly, someone is. Lol","857944996414189568",https://twitter.com/TransAmandaG/status/857944996414189568
Muguetzzle,2017-04-28 09:07,0,"Don't wanna do this . Think I don't wanna do this . Still, can't make up my mind...","857944377284591621",https://twitter.com/Muguetzzle/status/857944377284591621
toTAAlly_badd,2017-04-28 09:04,0,"My roommate's dog pooped inside her lunchbox. She was unpacking and it was on the floor I can't make this stuff up","857943641792421890",https://twitter.com/toTAAlly_badd/status/857943641792421890
userexperience,2017-04-28 09:02,6,"Overheard on the SF ferry (for real). (Guy 1) "Are you a sales guy"? (Guy 2) " I prefer to call myself a storyteller". Can't make this up !","857942981340516352",https://twitter.com/userexperience/status/857942981340516352
leewd19,2017-04-28 08:49,0,"I agree Leigh, I can't understand why Ajit wouldn't want to release this information so cabbies can make their minds up who to vote for!","857939706918645760",https://twitter.com/leewd19/status/857939706918645760
brifreeman22,2017-04-28 08:24,0,"I swear I can't make this shit up","857933660221296641",https://twitter.com/brifreeman22/status/857933660221296641
UNCgrad_99,2017-04-28 08:24,0,"Can't ITBAir make a special trip down and pick you up ? I mean, it seems like an emergency at this point.","857933470122770432",https://twitter.com/UNCgrad_99/status/857933470122770432
kreamreg,2017-04-28 08:24,0,"I can't make this up","857933453211435008",https://twitter.com/kreamreg/status/857933453211435008
JustTbo,2017-04-28 08:23,0,"If I did a thread of @bossbarb randomly twerking during our trip I 'd be posting for days I can't make this up she's addicted to twerking pic.twitter.com/RganBbxICr","857933175322017794",https://twitter.com/JustTbo/status/857933175322017794
RyderAndHarper,2017-04-28 08:13,0,"Whatever!!!! I kid you not!!! Can't make this shit up !!!!","857930811668135937",https://twitter.com/RyderAndHarper/status/857930811668135937
ClearBelly,2017-04-28 08:11,0,"Quote of the Day - Donald Trump: " I thought being president would be easier." You can't make this stuff up .","857930167326355456",https://twitter.com/ClearBelly/status/857930167326355456
RyderAndHarper,2017-04-28 08:06,0,"I swear I can't make this shit up wtf","857928893050834947",https://twitter.com/RyderAndHarper/status/857928893050834947
emmanikohl,2017-04-28 07:53,0,"I tried doing this , but I can't make up my mind. https:// twitter.com/Nick_Art13/sta tus/304800435707969536 …","857925790486450177",https://twitter.com/emmanikohl/status/857925790486450177
GraceLezcano,2017-04-28 07:31,0,"I woke up at 4am to make my husband breakfast before he went to work & now I can't go back to sleep this is why I can't do nice things","857920322741440513",https://twitter.com/GraceLezcano/status/857920322741440513
DasJugghead,2017-04-28 07:30,0,"You can't make up this level of stupid. At first I thought this was an outtake from Zoolander. https:// twitter.com/warpedwillie/s tatus/857732952788226048 …","857919924810985473",https://twitter.com/DasJugghead/status/857919924810985473
luluhan_1990,2017-04-28 06:50,10,"How are u all?! Haven't been posting much AHHH I 've had sooo many major tests this week I actually can't Here's cute lu to make up for it pic.twitter.com/vk9ltaLSlw","857909871252979713",https://twitter.com/luluhan_1990/status/857909871252979713
LynniMegginson,2017-04-28 06:40,2,"" I feel like I 'm being criminalized" he says to the police officer while wearing a mask over his face. You can't make this stuff up . https:// twitter.com/thesaintpepe/s tatus/857680259549974528 …","857907262379237376",https://twitter.com/LynniMegginson/status/857907262379237376
DelaneyMaeXXX,2017-04-28 06:39,0,"Also: get this -- the cops asked me if I got paid to suck his cock can't even make this Shit up ...","857907126387265536",https://twitter.com/DelaneyMaeXXX/status/857907126387265536
TeflonDon_Gotti,2017-04-28 06:28,0,"My Last Msg From Goop "Tell Everybody Bars On Deck " I Can't Make This Up Long Live Goop Troop !","857904369102184448",https://twitter.com/TeflonDon_Gotti/status/857904369102184448
MelanieWebbSA,2017-04-28 06:21,1,"I know we keep saying this ...BUT YOU REALLY CAN'T MAKE THIS STUFF UP !!!","857902542637989889",https://twitter.com/MelanieWebbSA/status/857902542637989889
NeoLouie,2017-04-28 05:30,0,"Happy Birthday @oxford5_chris have a good one mate, sorry I can't make it this weekend but we will make up for it another time pic.twitter.com/blXoXrXoZH","857889785926615040",https://twitter.com/NeoLouie/status/857889785926615040
FavianQuezada,2017-04-28 05:22,0,"@POTUS reflects on his first 100 days. Says he thought the job would be easier. I can't make this stuff up . https:// youtu.be/Qo3fT0xPeHs","857887815882944512",https://twitter.com/FavianQuezada/status/857887815882944512
cheekydesign,2017-04-28 04:41,0,"Check out this cute panda fabric I picked up last weekend! I can't wait to make some fun items… https://www. instagram.com/p/BTbDYH3FRzk/","857877492669054976",https://twitter.com/cheekydesign/status/857877492669054976
NateisaKing,2017-04-28 04:18,0,"Can't believe I have to back Death up on this and make some helpful points.","857871756064833540",https://twitter.com/NateisaKing/status/857871756064833540
inspiremeier,2017-04-28 03:58,1,"Donald Trump says " I thought it would be easier." Seriously? You can't make this up .... -.- http://www. reuters.com/article/us-usa -trump-100days-idUSKBN17U0CA?feedType=RSS&feedName=topNews&utm_source=twitter&utm_medium=Social …","857866522936713216",https://twitter.com/inspiremeier/status/857866522936713216
Tituca,2017-04-28 03:40,0,"You can't make this shit up : ' I thought being president would be easier': Trump's Reuters interview highlights https://www. theguardian.com/us-news/2017/a pr/28/i-thought-being-president-would-be-easier-trumps-reuters-interview-highlights?CMP=Share_iOSApp_Other …","857862079910424577",https://twitter.com/Tituca/status/857862079910424577
DSonBlue,2017-04-28 03:17,2,"You can't make this stuff up . EVERY one of the scribes I follow (bar Brennan) is defending Utd for last night. Not ONE mocking their demise.","857856305645711362",https://twitter.com/DSonBlue/status/857856305645711362
elmexinegro,2017-04-28 03:02,0,"I can't make this shit up pic.twitter.com/nYQw5hJ8fr","857852457082212352",https://twitter.com/elmexinegro/status/857852457082212352
pinkGoTfan,2017-04-28 03:00,0,"I think this so far is my favourite snippet you guy make me crack up , can't wait to see #GotGVol2 on Sunday","857851955263176706",https://twitter.com/pinkGoTfan/status/857851955263176706
NeriahVallery,2017-04-28 02:57,0,"Almost graduating my beauty class! I 'm gonna be a professional make up artist! Can't wait to turn this into a career","857851312267943936",https://twitter.com/NeriahVallery/status/857851312267943936
HeadsUp7Duck,2017-04-28 02:43,0,"RT @2HardofATime : I can't make this up ! ATF and feds stormed our plane. Came with… https://www. instagram.com/p/BTau-H6DuPtQ coWOYwyXVpji7wKsJvcwn_hFtg0/ …","857847645305548800",https://twitter.com/HeadsUp7Duck/status/857847645305548800
PrincessNajae,2017-04-28 02:23,0,"I don't know my password to any of my pages. I can't make this up","857842803396751360",https://twitter.com/PrincessNajae/status/857842803396751360
Del_e_uhhh,2017-04-28 02:13,0,"She and I just stared at each other crying at her door..... I promise.... I can't make this shit up pic.twitter.com/5koqTh26OJ","857840164000997377",https://twitter.com/Del_e_uhhh/status/857840164000997377
FringeBenefitsi,2017-04-28 01:52,0,"I can't make this shit up ! I just wanted food ! @Flatiron Bar https://www. instagram.com/p/BTav9lVhRXD/","857834792993251328",https://twitter.com/FringeBenefitsi/status/857834792993251328
CarsonWeekly,2017-04-28 01:44,0,"I can't make this shit up pic.twitter.com/S2u3CMelGM","857832995994161153",https://twitter.com/CarsonWeekly/status/857832995994161153
2HardofATime,2017-04-28 01:43,0,"I can't make this up ! ATF and feds stormed our plane. Came with… https://www. instagram.com/p/BTau-H6DuPtQ coWOYwyXVpji7wKsJvcwn_hFtg0/ …","857832618217361408",https://twitter.com/2HardofATime/status/857832618217361408
psmaria_92,2017-04-28 01:24,0,"Right?!?! Haha I 'd even be like I have a very important appt I can't miss on this day Professor, would I be able to make up the exam? Etc","857827884571828224",https://twitter.com/psmaria_92/status/857827884571828224
katdaddyruffin,2017-04-28 01:18,0,"i wish i could make this up , but i can't pic.twitter.com/z2IhlnnGSn","857826260021542912",https://twitter.com/katdaddyruffin/status/857826260021542912
carlysmasher,2017-04-28 01:14,1,"Remember that whole " I can't make this stuff up " thing about me traveling? Just got to Dulles,… https://www. instagram.com/p/BTaroLSlkFA/","857825268525936640",https://twitter.com/carlysmasher/status/857825268525936640
Socceratis,2017-04-28 01:13,0,"You did not just make a "yes we exist" post. This can't be true. I looked up to you man","857825030973136898",https://twitter.com/Socceratis/status/857825030973136898
____FunSize,2017-04-28 01:07,0,"He say he down on his luck when really he don't give a fuck. I can't make this up .","857823616645332992",https://twitter.com/____FunSize/status/857823616645332992
BTS_Report,2017-04-28 01:06,0,"Too bad I can't make this trip. Would've enjoyed catching up https:// twitter.com/norcrosshoops/ status/857715943379783680 …","857823393458126848",https://twitter.com/BTS_Report/status/857823393458126848
keya_marie21,2017-04-28 01:05,0,"I seriously can't make this shit up .","857822980549656576",https://twitter.com/keya_marie21/status/857822980549656576
naturalbylaw,2017-04-28 01:02,0,"Can't make this Up .. just what i came across #Autochthonous #Aborigines #Indigenous … https://www. instagram.com/p/BTaqUk9j062/","857822391036149764",https://twitter.com/naturalbylaw/status/857822391036149764
wendavious,2017-04-28 00:42,0,"ok and I chilled with that white girl n guess what she told me, I can't make this up lmfaooooooo","857817232352702465",https://twitter.com/wendavious/status/857817232352702465
garyalexis313,2017-04-28 00:36,0,"I can't make this stuff up . https://www. instagram.com/p/BTanQ8CFawC/","857815734675800064",https://twitter.com/garyalexis313/status/857815734675800064
lexxii__babee,2017-04-28 00:25,0,"Can't bring Erica bday in w her cos of work, and I gotta work the night of her bday . I 'll make up for it this weekend tho","857812989440917505",https://twitter.com/lexxii__babee/status/857812989440917505
ZDensford,2017-04-28 00:22,0,"Bush v. Romney in a battle to own the Marlins... Can't make this stuff up , gotta love politi.. I mean sports https:// twitter.com/ken_rosenthal/ status/857810476746592256 …","857812142917136384",https://twitter.com/ZDensford/status/857812142917136384
RogerF1953,2017-04-28 00:17,1,"I 'm selfishly enjoying 1 aspect of @realDonaldTrump . Every single day I get to say "You can't make this shit up ." Stranger than fiction!","857810964921565184",https://twitter.com/RogerF1953/status/857810964921565184
AlphonzaJr,2017-04-28 00:16,0,"I swear I can't make this up","857810804439121920",https://twitter.com/AlphonzaJr/status/857810804439121920
Killface_B00sh,2017-04-28 00:16,0,"#unemployment #castratedCaitlyn " I don't believe in property" you can't make this stuff up lol https:// twitter.com/polnewsnet/sta tus/856536323192127488 …","857810802916687872",https://twitter.com/Killface_B00sh/status/857810802916687872
TeSeauxMuch,2017-04-28 00:12,0,"Only reason I 'm up is because this shit hurting and I can't find a comfortable position to lay in that won't make it worse","857809835022274560",https://twitter.com/TeSeauxMuch/status/857809835022274560
nick_porcaro,2017-04-28 00:12,0,"@drdre gotta give up on this @AppleMusic jawn and put #Compton on @Spotify ! I can't make a turnt playlist without at LEAST 1/4 of that album","857809728092737537",https://twitter.com/nick_porcaro/status/857809728092737537
THEMarkPace,2017-04-28 00:11,0,"You can't make this stuff up . I had to triple check this one. It seemed too good to be true. https:// twitter.com/timesfreepress /status/857809103896403969 …","857809408742621185",https://twitter.com/THEMarkPace/status/857809408742621185
JoelFinkelman,2017-04-28 00:09,0,"Final time cat Geno spent licking my beard? 14 minutes. I can't make this stuff up . Only stopped because wife rolled over and scared him.","857808937734819840",https://twitter.com/JoelFinkelman/status/857808937734819840
GumboSensei,2017-04-28 00:09,0,"I ain't forget y'all wanted to trade Armstead halfway through the season. Now y'all complaining about OL. Can't make this up .","857808934161326081",https://twitter.com/GumboSensei/status/857808934161326081
MeTweetGrizz,2017-04-27 23:59,0,"Stay positive dude chanted. Can't make this stuff up . I 'm getting to Whole Foods early to buy up all the bran flakes before he gets there.","857806379502981120",https://twitter.com/MeTweetGrizz/status/857806379502981120
marisaaah_,2017-04-27 23:58,0,"There is a couple literally breaking up at the table next to me & I would live tweet this shit but I can't make out enough of the convo","857806102410313728",https://twitter.com/marisaaah_/status/857806102410313728
jenncalderale,2017-04-27 23:56,5,"i keep trying to make up witty tweets but my brain is so fried from this week that i can't function and i 've developed an eye twitch","857805765217845249",https://twitter.com/jenncalderale/status/857805765217845249
SprntgStilettos,2017-04-27 23:54,2,"I read this and think, wow, you can't make this stuff up . Libs are out of control. Time for the @BCGreens . #bcpoli https:// twitter.com/skeenawatershe d/status/857776387603578881 …","857805226471899136",https://twitter.com/SprntgStilettos/status/857805226471899136
_VenaBme,2017-04-27 23:50,0,"I can't make this stuff up","857804087726878720",https://twitter.com/_VenaBme/status/857804087726878720
keepngupwithlex,2017-04-27 23:47,0,"I Can't Make This Up !!","857803323247910912",https://twitter.com/keepngupwithlex/status/857803323247910912
MimziiSkull,2017-04-27 23:46,4,"Can I also point out that this menu says "GRASS FED comfort beef stew" y'all i can't make this up https:// twitter.com/mimziiskull/st atus/857801609971216384 …","857803252544491521",https://twitter.com/MimziiSkull/status/857803252544491521
SquallyThuggin,2017-04-27 23:42,0,"I tweet a lot of dumb shit but I really can't make this shit up .","857802114776563712",https://twitter.com/SquallyThuggin/status/857802114776563712
ismahenxo,2017-04-27 23:41,0,"I look so ugly at this time of the day, even make up can't help","857802039312699397",https://twitter.com/ismahenxo/status/857802039312699397
septian,2017-04-27 23:37,0,"Trump: " This is more work than in my previous life. I thought it would be easier." You just can't make this stuff up . https:// twitter.com/STcom/status/8 57799068352823296 …","857801038421606400",https://twitter.com/septian/status/857801038421606400
GodisRivera,2017-04-27 23:35,0,"“ This is more work than in my previous life. I thought it would be easier.” - 45 You can't make this stuff up . SMH. https:// twitter.com/huffpost/statu s/857798047509745664 …","857800460236935168",https://twitter.com/GodisRivera/status/857800460236935168
SweeetJones,2017-04-27 23:28,0,"I can't make this up nigga grown af","857798571617386496",https://twitter.com/SweeetJones/status/857798571617386496
_Xpresss,2017-04-27 23:23,0,"I can't make this up","857797505635020800",https://twitter.com/_Xpresss/status/857797505635020800
Dang3lo_,2017-04-27 23:10,0,"The space I 'm in, indescribable... can't make this shit up ... un día a la vez...","857794067043934208",https://twitter.com/Dang3lo_/status/857794067043934208
I_wish_but,2017-04-27 23:01,2,"On the brink of nuclear war with N. Korea, then he goes & piss off our S. Korean ally. Can't make this shit up ! Probably got the 2 confused","857791788400222209",https://twitter.com/I_wish_but/status/857791788400222209
Hydrocharlie,2017-04-27 23:00,0,"I can't make this up this is the guy that sent me Stroman for Pollock. But he just now dropped Greg Bird lol","857791719273836544",https://twitter.com/Hydrocharlie/status/857791719273836544
Paulito_3,2017-04-27 23:00,0,"I know this isn't appropriate but the kid who has sexual abuse charge pending is going to Vegas Raiders, priceless! You can't make this up","857791486682910721",https://twitter.com/Paulito_3/status/857791486682910721
MikeBaringer,2017-04-27 22:57,0,"I love Miami. You can't make this up !!","857790786104152064",https://twitter.com/MikeBaringer/status/857790786104152064
HotboyLouu,2017-04-27 22:56,0,"lol Maxo show got every weirdo in here I can't make this up","857790699210756099",https://twitter.com/HotboyLouu/status/857790699210756099
jj0ule,2017-04-27 22:55,0,"I was volunteered to do make up for prom tomorrow when I can't even do my own properly can someone PLZ save me from ruining this girls prom","857790423783297024",https://twitter.com/jj0ule/status/857790423783297024
Carter_SG1_,2017-04-27 22:49,0,"-- out. " I hope someone here knows, because I can't make heads or tails out of this . Sam reached up to touch it, then thought better of --","857788830568591360",https://twitter.com/Carter_SG1_/status/857788830568591360
Salute_DeezNutz,2017-04-27 22:42,4,"I got pulled by a cop while bumping pretty boy swag. Nigga was a kappa. You really can't make this shit up .","857787111587631110",https://twitter.com/Salute_DeezNutz/status/857787111587631110
Lynx2Lancer,2017-04-27 22:41,0,"News in 2017-- can't make this stuff up even if we tried.... I 'd've thought Spicey came up with that! https:// twitter.com/DesignPolice/s tatus/857785862263889920 …","857786843605159937",https://twitter.com/Lynx2Lancer/status/857786843605159937
eclipsedave,2017-04-27 22:26,0,"Every damn day on the news I have to hear the same thing over and over again: "You can't make this stuff up ."","857783171739377664",https://twitter.com/eclipsedave/status/857783171739377664
ju_horan1,2017-04-27 22:24,0,"Tbt to when my Chem final got lost and I got a straight up 0 so I failed the class I legit can't make this shit up","857782662592815104",https://twitter.com/ju_horan1/status/857782662592815104
ohyeahitsangel,2017-04-27 22:22,0,"I was supposed to travel and go everywhere this summer but I 'm a dog owner now and can't leave Aldo.. gots hurry up & make him a service dog","857781930867249152",https://twitter.com/ohyeahitsangel/status/857781930867249152
Nancy_C,2017-04-27 22:20,0,"Today's @CNN "Top Stories" You can't make this up . ( I circled the problem area for #Trumpsters and other not-so-sharps.) #news #ThanksObama pic.twitter.com/kUZR0SzQfk","857781446936743936",https://twitter.com/Nancy_C/status/857781446936743936
DADAMNDEJ,2017-04-27 22:18,4,"Speaking good things into existence really works for me. I can't make this up","857780955788062720",https://twitter.com/DADAMNDEJ/status/857780955788062720
qparler,2017-04-27 22:17,0,"I can't make this stuff up ! Chamberlin! Chamberlin! Chamberlin! Just drink it Chamberlin! Enough… https://www. instagram.com/p/BTaXbg4FYvr/","857780851312078848",https://twitter.com/qparler/status/857780851312078848
shelbyrenae,2017-04-27 22:16,1,"I messed up guys. I can't beat the hangover. Only time will fix it... I will make this up to you Friday and Saturday 100%. Forgive me","857780601314828288",https://twitter.com/shelbyrenae/status/857780601314828288
iaiaiohve,2017-04-27 22:11,0,"FR I can't make this shit up lmao https:// twitter.com/chaetiful/stat us/857779077071163392 …","857779207568367616",https://twitter.com/iaiaiohve/status/857779207568367616
PhillyKG,2017-04-27 21:59,1,"We picked a slow DE for a wide 9 scheme. I can't make this shit up","857776264618422273",https://twitter.com/PhillyKG/status/857776264618422273
_BabyKadi,2017-04-27 21:51,4,"I said this year I would go up , then I said it's all about the finish, and now I can't even make it to class","857774322806607874",https://twitter.com/_BabyKadi/status/857774322806607874
ZDimpsey,2017-04-27 21:47,0,"Son lean heads wylin over a DBZ fusion I can't make this up lol","857773224582684675",https://twitter.com/ZDimpsey/status/857773224582684675
deiiiidre,2017-04-27 21:45,0,"SOS I 'm taking this to twitter because I can't make up my mind: Do I go out tonight?","857772784667283456",https://twitter.com/deiiiidre/status/857772784667283456
turboshannie,2017-04-27 21:44,0,""he came into my room and he played me." I CAN'T MAKE THIS STUFF UP !!! <3 <3 #supernatural #destiel","857772534250348545",https://twitter.com/turboshannie/status/857772534250348545
AbsoluteZero0K,2017-04-27 21:31,0,"I can't believe that the Bucks came back to make this a B-Ball game. Toronto was up TWENTY FIVE POINTS!","857769132770680832",https://twitter.com/AbsoluteZero0K/status/857769132770680832
ajknight51,2017-04-27 21:31,0,"You can't make up this stuff. And Priebus' comments? I 'd love to play poker with him.","857769094413766656",https://twitter.com/ajknight51/status/857769094413766656
AJDunK,2017-04-27 21:30,0,"I Can't Make This Up podcast ep 72 iTunes: https:// itun.es/us/TvFg_.c Android:… https://www. instagram.com/p/BTaSDPshQCT/","857769052973879296",https://twitter.com/AJDunK/status/857769052973879296
SeanNuwan,2017-04-27 21:26,1,"This weather just like my girl when I ask her what she wanna eat, can't make up it's mind smh.","857768046986895360",https://twitter.com/SeanNuwan/status/857768046986895360
laurelizabetthh,2017-04-27 21:17,0,"I can't make this shit up","857765760642424832",https://twitter.com/laurelizabetthh/status/857765760642424832
Simplyyyycee,2017-04-27 21:09,0,"Lmao u know I can't make this up","857763658809692160",https://twitter.com/Simplyyyycee/status/857763658809692160
R_R_R_Jr,2017-04-27 21:08,0,"I 'm telling you....You can't make this mess up . They are the most no accountability having folk I 've ever seen. https:// twitter.com/bryanbehar/sta tus/857762354066472960 …","857763465116733440",https://twitter.com/R_R_R_Jr/status/857763465116733440
PoundSignDead,2017-04-27 21:06,0,"I can't make this shit up if I tried b","857762838303191040",https://twitter.com/PoundSignDead/status/857762838303191040
allisongarcia__,2017-04-27 20:57,0,"I can't make this shit up","857760592605491200",https://twitter.com/allisongarcia__/status/857760592605491200
MrMontana911,2017-04-27 20:56,0,"I just seen from Bleacher that the Browns are trying to trade for Kirk Cousins. Can't make this up . #NFLDraft","857760511919828992",https://twitter.com/MrMontana911/status/857760511919828992
Lugidog,2017-04-27 20:53,0,"I 'LL JUST MAKE SOMETHING UP IF I CAN'T GET IN BUT UGH THIS IS ANNOYING","857759654998269952",https://twitter.com/Lugidog/status/857759654998269952
Daisyybeam,2017-04-27 20:31,0,"I can't make this stuff up people.","857754048077934599",https://twitter.com/Daisyybeam/status/857754048077934599
SkwizzoScorsese,2017-04-27 20:28,0,"Today was another day filled with petty wonders.. swear I can't make this shit up","857753373348687872",https://twitter.com/SkwizzoScorsese/status/857753373348687872
NRaub,2017-04-27 20:25,0,"I can't believe it and we gave up that much for him. Huge pace fan but this will either make him or get him fired","857752695892869121",https://twitter.com/NRaub/status/857752695892869121
