hakbooty,2017-04-26 19:43,0,"i literally can't make this shit up . as i 'm looking thru this twt, my aries bias is being confirmed more and more. why do i even bother","857379634354245633",https://twitter.com/hakbooty/status/857379634354245633
icreatepoems,2017-04-26 19:43,0,"also I got lupins wand and he got sirius', can't make this shit up","857379532713676800",https://twitter.com/icreatepoems/status/857379532713676800
itsashyworld,2017-04-26 19:41,0,"i can't make this up","857379057994010625",https://twitter.com/itsashyworld/status/857379057994010625
Jake_Gearty,2017-04-26 19:38,0,"What kind of bee can't make up its mind? A maybee I 've just spent 10mins giggling away to myself at this joke #NightShift","857378341678198784",https://twitter.com/Jake_Gearty/status/857378341678198784
neshamitch,2017-04-26 19:33,0,"My dude crazy as hell oml, I can't make this shit up","857377226488197121",https://twitter.com/neshamitch/status/857377226488197121
lariti2,2017-04-26 19:32,0,"Hilarious. I mean, you just can't make this stuff up . Nice one, @Kris_Sacrebleu https:// twitter.com/Kris_Sacrebleu /status/857376173155794945 …","857376974658052097",https://twitter.com/lariti2/status/857376974658052097
PTX_On_My_Mind,2017-04-26 19:31,0,"" I wanna give you my love..." but I can't cause I need this to say delivered. @SUP3RFRUIT make it hurry up !!! #waitingishard pic.twitter.com/DJgItwB4hv","857376607492755456",https://twitter.com/PTX_On_My_Mind/status/857376607492755456
bruch_amy,2017-04-26 19:24,0,"I believe that is the one And then, after all that, he defended her!! You can't make this shit up ?? https:// twitter.com/patriotswanted /status/857340579277148162 …","857374733939097600",https://twitter.com/bruch_amy/status/857374733939097600
RyanEasterling,2017-04-26 19:19,1,"I 'm playing this game right now where I can't hear anything, so I just make up my own words for what I think the AD is saying.","857373557655035905",https://twitter.com/RyanEasterling/status/857373557655035905
Kam_Possible,2017-04-26 19:16,0,""You have a Josh Turner sound" I can't make this stuff up","857372812453048321",https://twitter.com/Kam_Possible/status/857372812453048321
axpze,2017-04-26 19:12,0,"I can't make this stuff up , but the motto of @TPUSA is literally "Drink the Potty."","857371773431578624",https://twitter.com/axpze/status/857371773431578624
likeatrooper,2017-04-26 19:11,0,"you're gonna make me cry ahahaha thank you so much, I can't actually say thank you enough, I 've felt shit all day this is bringing me up !","857371587783393280",https://twitter.com/likeatrooper/status/857371587783393280
SeanTheGawd_,2017-04-26 19:09,0,"Yooooo Merchantville gave this nigga a ticket for doing 26 in a 25 I can't make this shit up man","857371066641125378",https://twitter.com/SeanTheGawd_/status/857371066641125378
ameetaks,2017-04-26 19:02,0,"Another fail for @panerabread . Says NO PULLED CHICKEN, and what do they do? Give pulled chicken. I can't make this up . pic.twitter.com/ATNyYIUNOT","857369243045834752",https://twitter.com/ameetaks/status/857369243045834752
trillHAM,2017-04-26 18:56,0,"Mayberry got shrimp and grits> I can't make this up","857367685646168064",https://twitter.com/trillHAM/status/857367685646168064
Val_Marchini,2017-04-26 18:53,0,"A pet peeve: when something crazy happens and someone says "you can't make this stuff up !" I think, "yeah, you can, if you're a writer!"","857367022111518721",https://twitter.com/Val_Marchini/status/857367022111518721
potterarchy,2017-04-26 18:45,0,"You just can't make this shit up . In other news, I am Officially Bad at Juggling.","857364989685907457",https://twitter.com/potterarchy/status/857364989685907457
lilgroth17,2017-04-26 18:36,0,"I just skipped class, went out to eat, and then I look over and my professor was sitting in the car next to me.... I can't make this up","857362738510692352",https://twitter.com/lilgroth17/status/857362738510692352
realkuzzofly,2017-04-26 18:18,0,"I can't make this up it's too Damm good @tyronejonesmedicatedbbqsauce everybody loves... http:// fb.me/7T29WqmHE","857358325339521024",https://twitter.com/realkuzzofly/status/857358325339521024
realkuzzofly,2017-04-26 18:18,0,"I can't make this up it's too Damm good @realkuzzofly everybody loves… https://www. instagram.com/p/BTXXR2NF7Gt/","857358307127951360",https://twitter.com/realkuzzofly/status/857358307127951360
MaggieHarnois,2017-04-26 18:18,0,"I can't make this stuff up","857358284529033220",https://twitter.com/MaggieHarnois/status/857358284529033220
Livi_licious,2017-04-26 18:18,0,"My face better clear up before I make this trip to Fl... I can't be going home looking worse than when I left","857358178924863488",https://twitter.com/Livi_licious/status/857358178924863488
chefheidifink,2017-04-26 18:05,0,"I 'm thrilled to be included in this round up .of AMAZING rhubarb recipes! I can't even decide what to make first. https:// twitter.com/foodbloggersCA /status/855760604396703745 …","857355056005369856",https://twitter.com/chefheidifink/status/857355056005369856
morse_evann,2017-04-26 18:01,0,"u ever take a horribly ugly sc of urself but u make urself crack up and think what do i do with this masterpiece it can't go to waste","857353921333002242",https://twitter.com/morse_evann/status/857353921333002242
ParysJade,2017-04-26 17:59,0,"I CAN'T MAKE THIS UP https:// twitter.com/billboardhipho p/status/857336977938673665 …","857353362433560576",https://twitter.com/ParysJade/status/857353362433560576
DeeDotJonesG4B,2017-04-26 17:56,0,"yo this hella fucked up why the aliens have to invade superafrica and make white folks now i can't even breathe n shit","857352695459438592",https://twitter.com/DeeDotJonesG4B/status/857352695459438592
InfamousEimyaj,2017-04-26 17:53,0,"Like I can't even make this up and you can tell that the people that surround her don't take her seriously","857352041018085377",https://twitter.com/InfamousEimyaj/status/857352041018085377
treonn__,2017-04-26 17:52,0,"don't want fuck up this friendship so i can't make it official","857351774193295360",https://twitter.com/treonn__/status/857351774193295360
SamShearererer,2017-04-26 17:47,0,"I can't say " this didn't make sense" I have to say "maybe this could make more sense if you cleared it up " which means the same damn thing","857350558566318081",https://twitter.com/SamShearererer/status/857350558566318081
TrayTheBay,2017-04-26 17:45,0,"I thought I saw it all until I walked into frys and saw a coworker wearing timbs... I can't make this up","857349976099348485",https://twitter.com/TrayTheBay/status/857349976099348485
bmatic33,2017-04-26 17:45,0,"I can't make this up ...sorry Brook pic.twitter.com/0eLZv37Nkz","857349957011087360",https://twitter.com/bmatic33/status/857349957011087360
KekMememonger,2017-04-26 17:44,0,"Quote: “ I refuse to face the complexities of this issue, so I ’m deliberately oversimplifying it.” Hahahahaha. You can't make this shit up .","857349784235069441",https://twitter.com/KekMememonger/status/857349784235069441
seamermaidx,2017-04-26 17:42,0,"So let me add this , he's very socialable and will walk up to a party just to " make friends". He's not afraid of much & I just can't","857349219820199937",https://twitter.com/seamermaidx/status/857349219820199937
SwiftJustus,2017-04-26 17:40,0,"I 've never screwed up this much all in my life. And it's only taken me a week. Can't seem to ever make anything better.","857348792722509824",https://twitter.com/SwiftJustus/status/857348792722509824
CoachKWright,2017-04-26 17:38,0,"I can't make this stuff up , this is by far the best 2017 ATH in the class of 17 pic.twitter.com/pw8GyTgXcV","857348126868471808",https://twitter.com/CoachKWright/status/857348126868471808
Misshalfstep,2017-04-26 17:33,0,"I can't make this shit up .","857346898042159105",https://twitter.com/Misshalfstep/status/857346898042159105
CC_34,2017-04-26 17:32,0,"I can't make this up ..","857346594626314245",https://twitter.com/CC_34/status/857346594626314245
Zyun_Mommy,2017-04-26 17:30,0,"I Can't Make This Up https://www. instagram.com/p/BTXRwKyFXuDk VocQBJvYODP1KqmaQF7FIP5JT80/ …","857346152638935040",https://twitter.com/Zyun_Mommy/status/857346152638935040
AnistonAnarchis,2017-04-26 17:09,0,"@brandon120 @ElKenerico I can't make this up , Beth Behrs like to tap dance naked. https://www. youtube.com/watch?v=7HR8th QpH80 …","857340976192507904",https://twitter.com/AnistonAnarchis/status/857340976192507904
da13thsun,2017-04-26 17:00,10,"Nobody see Th name Yehuda & Buddha lmfao I can't even make this stuff up if I wanted to. Truth shall be revealed in last days","857338726346887168",https://twitter.com/da13thsun/status/857338726346887168
DPort502,2017-04-26 16:52,0,"Just saw a sign that read "kill your local heroin dealer" LOL i can't make this shit up people","857336542376976384",https://twitter.com/DPort502/status/857336542376976384
ThePhamousOG,2017-04-26 16:46,0,"I can't make this stuff up .","857335087259688961",https://twitter.com/ThePhamousOG/status/857335087259688961
FredsFakeFiance,2017-04-26 16:39,0,"Bonifacio is translated from the Latin words bonum ("good") and fatum ("fate" or "destiny"). I can't make this shit up . #Braves","857333430601887745",https://twitter.com/FredsFakeFiance/status/857333430601887745
tjmcgrew,2017-04-26 16:35,0,"This video lives up to its name, and I can't imagine how long it took too make it. epic conway's game of life https:// youtu.be/C2vgICfQawE","857332327013371904",https://twitter.com/tjmcgrew/status/857332327013371904
JarvisIandry,2017-04-26 16:21,0,"Went on YouTube to look at mock drafts and i saw Eddie Jackson at 12 you can't make this up","857328745983729665",https://twitter.com/JarvisIandry/status/857328745983729665
gitgit034,2017-04-26 16:16,0,"I swear girl lmao I can't even make this stuff up !! Lmao!","857327665640079360",https://twitter.com/gitgit034/status/857327665640079360
FilterlessBeast,2017-04-26 16:04,0,"I swear I did not make this up . I screenshot it out of an online news article. Not revealing the source. Just can't stop laughing about it! pic.twitter.com/AotSQ5NSql","857324612501118976",https://twitter.com/FilterlessBeast/status/857324612501118976
JenCalonita,2017-04-26 16:04,0,"Practicing lax with my 12-year-old and just hit myself in the head with a lacrosse ball. I can't make this stuff up .","857324496856002560",https://twitter.com/JenCalonita/status/857324496856002560
ophieoNo,2017-04-26 16:02,3,"sorry. I 'm just...the man spent eight whole ass years trying to fix this country, and now he can't make money before the world blows up ?","857324104881491968",https://twitter.com/ophieoNo/status/857324104881491968
Zoolok17,2017-04-26 15:50,0,"Sektasenje i verska indoktrinacija u buducoj agenciji za Internet konsalting i marketing. You can't make this shit up .","857321000895205376",https://twitter.com/Zoolok17/status/857321000895205376
JustnSlayer,2017-04-26 15:49,0,"Who you tellin. Man why i got like 7 (left) Nike elite shoes and like 4 (rights). I can't make this up , ain't no rights bih!!!!","857320634875076609",https://twitter.com/JustnSlayer/status/857320634875076609
SueReu,2017-04-26 15:44,0,"I swear you can't make this shit up .... https:// twitter.com/mic/status/857 318905198587904 …","857319396242464768",https://twitter.com/SueReu/status/857319396242464768
largemargg,2017-04-26 15:34,1,"A HOMELESS GUY JUST CAME INTO THE VINE SCREAMING & RODE HIS BIKE INTO ALL OF OUR TABLES/CHAIRS I CAN'T MAKE THIS SHIT UP","857316878301118464",https://twitter.com/largemargg/status/857316878301118464
autumjjewel,2017-04-26 15:22,0,"I can't make this up .","857314054439804928",https://twitter.com/autumjjewel/status/857314054439804928
Arakkoa,2017-04-26 15:21,14,"(( I can't make up my mind about how to end this storyline. Help me decide!))","857313650339655681",https://twitter.com/Arakkoa/status/857313650339655681
BFHSNetwork,2017-04-26 15:13,0,"READ MORE>>> I Can't Make This Up : Life Lessons: Kevin Hart, Neil Strauss: #Books http:// amzn.to/2oLqO8A pic.twitter.com/ZryXuXp68p","857311644216680448",https://twitter.com/BFHSNetwork/status/857311644216680448
dakkymonster,2017-04-26 15:08,1,"seriously can't make this shit up , here's what I ordered on eBay, here's what came in the post today pic.twitter.com/l0iZSm5mkc","857310544239489025",https://twitter.com/dakkymonster/status/857310544239489025
o_Shakes,2017-04-26 15:08,0,"I can't make this shit up pic.twitter.com/MJNVz8ustB","857310484055326720",https://twitter.com/o_Shakes/status/857310484055326720
pooler_crew,2017-04-26 15:06,2,"I can't make this up !! Sprint Unlimited just got better with the 5th line FREE! that's 5 lined for $120 - 238 Pooler Prkway Pooler Ga 31322","857309806067146753",https://twitter.com/pooler_crew/status/857309806067146753
BHAM_20,2017-04-26 15:04,0,"I can't make this up","857309302834507776",https://twitter.com/BHAM_20/status/857309302834507776
courtshepler,2017-04-26 15:02,0,"I really just wish @skhoad could make this for me! I can't doctor it up like he can lol pic.twitter.com/6gEjFhgQbt","857308922083819520",https://twitter.com/courtshepler/status/857308922083819520
ayOreohead,2017-04-26 14:55,0,"when someone else sees the bullshit these people come to me >> << like I Can't make this shit up dawg. these people","857307052456194048",https://twitter.com/ayOreohead/status/857307052456194048
_Herr,2017-04-26 14:52,0,"I can't make this up Lmfaooo","857306354180136960",https://twitter.com/_Herr/status/857306354180136960
nafisaal,2017-04-26 14:46,1,"This is one guy I can't make up my mind about, he appears not to be sucking up yet unleashes vitriol on voters...anafikiria aje?","857304962707148800",https://twitter.com/nafisaal/status/857304962707148800
LadyTrvlr,2017-04-26 14:33,0,"I 'm half way up . Can't make it to the top. I did good to make it this far. How do I get down? YIKES!!! Oh... http:// fb.me/8EQnfuQbF","857301670795104259",https://twitter.com/LadyTrvlr/status/857301670795104259
ravenous_fox,2017-04-26 14:18,0,"Our gifts for the day: $1 mirrors from Family Dollar. I can't make this up … https://www. instagram.com/p/BTW7vsVhV0p/","857297755080859648",https://twitter.com/ravenous_fox/status/857297755080859648
itownhard,2017-04-26 14:15,0,"Hosmer ground out to 2nd... I can't even make this stuff up anymore #RaisedRoyal","857297018913517569",https://twitter.com/itownhard/status/857297018913517569
dinardodp,2017-04-26 14:06,0,"$24000 tax cut for couples; but #CNN talking #Trump taxes? You can't make this up folks, I want MY MONEY; damn him #Tax","857294842971508746",https://twitter.com/dinardodp/status/857294842971508746
PotatoForeman,2017-04-26 14:06,15,"Scott, Mitch, and Kirstin have all dated each other in the past and now they're in a band together you can't make this shit up I love it","857294816408997890",https://twitter.com/PotatoForeman/status/857294816408997890
ashlee_burgess,2017-04-26 13:57,0,"Heck yes we do! And I 'm not giving up on them! We can't make this shit up , it's bound to happen! #GetToScootin #GivingLimbs","857292494618447873",https://twitter.com/ashlee_burgess/status/857292494618447873
chrisb_batch,2017-04-26 13:54,0,"And they just cheat bumped eAch other and said dude bro that flipping awesome. lol I can't . Make this shit up","857291897135607808",https://twitter.com/chrisb_batch/status/857291897135607808
SmithLa_5,2017-04-26 13:54,0,"I can't make this stuff up man, it was wild. To make it worse, I was on the way to work","857291760996933633",https://twitter.com/SmithLa_5/status/857291760996933633
roboback,2017-04-26 13:54,0,"http://www. vox.com/2017/4/25/1542 9982/gop-exemption-ahca-amendment … u can't make this sh** up I mean seriously.....","857291755972112385",https://twitter.com/roboback/status/857291755972112385
meubanks44,2017-04-26 13:51,0,"for anybody that got my snaps, you can`t make this stuff up , lol I `ll just laugh my life for the rest of the day","857291008522014720",https://twitter.com/meubanks44/status/857291008522014720
SWchickadee,2017-04-26 13:49,0,"I can't come up with a single scenario in this short of time frame that will make any sense to me, I hope they surprise me, buttttt...","857290632636882946",https://twitter.com/SWchickadee/status/857290632636882946
JustAnt1914,2017-04-26 13:47,1,"Twitter fam.... do y'all know what the reply was? "That is TBD." y'all... Y'ALL... I can't make this up . #EbonyOwes","857290009770065920",https://twitter.com/JustAnt1914/status/857290009770065920
ScHoolBreadQ,2017-04-26 13:46,0,"You can't make this shit up people I fucking hate dogs now fuck dogs pic.twitter.com/2ImqE7ofRm","857289682836746240",https://twitter.com/ScHoolBreadQ/status/857289682836746240
TheEveningOwl,2017-04-26 13:44,2,"Like he went "You're only Anti-capitalist when Beyoncé sells millions of albums or Obama has a speaking fee." I can't make this up .","857289310185422848",https://twitter.com/TheEveningOwl/status/857289310185422848
hawkinatory,2017-04-26 13:40,0,"Fucking 5 people so far have asked why we have a bag of money outside I can't make this shit up","857288358111854592",https://twitter.com/hawkinatory/status/857288358111854592
JohnJAmo1,2017-04-26 13:37,0,"Can't Make This Shit Up ...Great news for Chicago. The carnage isn’t < i >much</ i > worse than last year… yet - Hot Air http:// hotair.com/archives/2017/ 04/25/great-news-chicago-carnage-isnt-much-worse-last-year-yet/ …","857287626490916864",https://twitter.com/JohnJAmo1/status/857287626490916864
ThePharaoh_20,2017-04-26 13:33,1,"Kid you not, the minute I brag about somebody or the levels we're on. We fall off .. I swear I can't make this shit up . wtf man","857286577923514368",https://twitter.com/ThePharaoh_20/status/857286577923514368
_FlyButModest,2017-04-26 13:25,0,"I can't make this up !!! I have been deliver'T","857284429634568193",https://twitter.com/_FlyButModest/status/857284429634568193
up_trumped,2017-04-26 13:22,0,"I can't wait to see how bad #Berkeley gets sued for this liberal act. Make up your own laws Berkley. https:// twitter.com/gracetiscareno /status/857283108697026560 …","857283714346348545",https://twitter.com/up_trumped/status/857283714346348545
luchi7,2017-04-26 13:10,7,"You can't make up the taking place in this country...oh wait I might be arrested for calling it https:// twitter.com/lauramiti/stat us/857279587482562560 …","857280691687624705",https://twitter.com/luchi7/status/857280691687624705
franc_loid,2017-04-26 13:01,0,"lol I can't make this stuff up","857278552282202112",https://twitter.com/franc_loid/status/857278552282202112
Cheeks1213,2017-04-26 12:56,0,"Been laughing hysterically... I can't make this up !","857277108212690946",https://twitter.com/Cheeks1213/status/857277108212690946
kitty_KATina,2017-04-26 12:50,0,"I can't make this shit up","857275725862318081",https://twitter.com/kitty_KATina/status/857275725862318081
realcamstuart,2017-04-26 12:45,0,"" I put a booty pic on tinder and someone actually venmo'd me" #ConversationsBehindCameron Can't make this shit up , it's a banner day","857274407567470592",https://twitter.com/realcamstuart/status/857274407567470592
alexbreck3,2017-04-26 12:33,0,"I literally can't make this shit up","857271350552952832",https://twitter.com/alexbreck3/status/857271350552952832
SJohnson_XXXII,2017-04-26 12:32,0,"I can't make this shit up lmao https:// twitter.com/_itsmikey831/s tatus/857265835181842434 …","857271242662977536",https://twitter.com/SJohnson_XXXII/status/857271242662977536
Its_Travy,2017-04-26 12:20,0,"I love we have a president who has now told a court twice that he'll "see them in court!" You can't make this sh!t up !","857268078190764035",https://twitter.com/Its_Travy/status/857268078190764035
drekaaa_,2017-04-26 12:12,112,"I swear I can't make this up https:// twitter.com/thekaybrooks/s tatus/857019852619382784 …","857266121917042690",https://twitter.com/drekaaa_/status/857266121917042690
kyunkyunnie,2017-04-26 12:10,0,"I have to leave in an hour and I can't even do my make up because I 'm a mess and I can't stop crying. This is awesome.","857265589643096065",https://twitter.com/kyunkyunnie/status/857265589643096065
_misslyssa_,2017-04-26 12:01,1,"Definitely going to open up an Etsy shop to sell my baby blankets & make some extra money. I can't wait to shop @craft stores this weekend.","857263270134206466",https://twitter.com/_misslyssa_/status/857263270134206466
Anon6_NvrForget,2017-04-26 11:47,0,"I can't make this up .. Must stop trusting these Liars.. We've all been had.. People are Waking up please do follow me and expose them","857259750630805504",https://twitter.com/Anon6_NvrForget/status/857259750630805504
yasssqueeen,2017-04-26 11:36,0,"And this is why I can't meet anyone. I have long hair and wear make up . So apparently I 'm not allowed to be attracted to women https:// twitter.com/bewarethefurry /status/857250008227336192 …","857257059141640192",https://twitter.com/yasssqueeen/status/857257059141640192
Blazeardx3,2017-04-26 11:29,0,"Fun fact: I can't make coffee for my life. I just tried and almost threw up . How do people do this shit?","857255442799570944",https://twitter.com/Blazeardx3/status/857255442799570944
pfbvan,2017-04-26 11:28,0,"@helpslaw I can't make this shit up https:// twitter.com/peatreebojangl e/status/857236653395587073 …","857255124607000576",https://twitter.com/pfbvan/status/857255124607000576
svenbaertschis,2017-04-26 11:27,0,"i can't believe y'all are gonna make me wake up before 12pst for this https:// twitter.com/falloutboy/sta tus/857248117045039108 …","857254741125980160",https://twitter.com/svenbaertschis/status/857254741125980160
gorskon,2017-04-26 11:22,17,"I ’m tellin’ ya. Ya can’t make stuff like this up . Excellent work, wild boars. https://www. usatoday.com/story/news/wor ld/2017/04/25/wild-boars-overrun-islamic-state-position-kill-3-militants/100876844/ …","857253455206993921",https://twitter.com/gorskon/status/857253455206993921
BFHSNetwork,2017-04-26 11:16,0,"READ MORE>>> I Can't Make This Up : Life Lessons: Kevin Hart, Neil Strauss: #Books … https://www. instagram.com/p/BTWm_NjBdqj/","857252114619289601",https://twitter.com/BFHSNetwork/status/857252114619289601
VanWhorey,2017-04-26 11:16,0,"I thank you changing my past what i can't do but i make up for everything i ain't do in this cold world you been my angel so i know its real","857252049406308352",https://twitter.com/VanWhorey/status/857252049406308352
shaaaaka_,2017-04-26 11:10,1,"i wanna do this but i can't do make up soooooooooo im terrified https:// twitter.com/youngdomo_/sta tus/856898439615041536 …","857250661234352128",https://twitter.com/shaaaaka_/status/857250661234352128
johnwil56313944,2017-04-26 11:00,0,"I 'm listening to " Can't Make This Up " by @Kevin_Gates on @PandoraMusic . #pandora http:// pdora.co/2pzsZ2T","857248103778459648",https://twitter.com/johnwil56313944/status/857248103778459648
DemontPinder,2017-04-26 10:59,0,"I can't make this stuff up ... this pic was just sent to me by my dear friend / supporter… https://www. instagram.com/p/BTWk-5zADmw/","857247700236079106",https://twitter.com/DemontPinder/status/857247700236079106
NoFordsClub,2017-04-26 10:51,0,"Giant rabbit, O'Hare... I guess you can't make this stuff up . https:// twitter.com/nationalpost/s tatus/857245170089197569 …","857245720641982464",https://twitter.com/NoFordsClub/status/857245720641982464
SoTribe_Kendall,2017-04-26 10:45,0,"Lmaooo yess! I can't make this shit up he know the real","857244312710643712",https://twitter.com/SoTribe_Kendall/status/857244312710643712
gracealittlebit,2017-04-26 10:42,0,"I thought 12 year olds only wore make up for dance recitals what's going on. This is why I can't have kids. https:// twitter.com/femaleiife/sta tus/856587805966819328 …","857243408024449029",https://twitter.com/gracealittlebit/status/857243408024449029
maddhattuh,2017-04-26 10:37,0,"5 seconds before I found him swinging my Nikes over his head by the shoelaces ( I can't make this shit up ) pic.twitter.com/lI3odOtRnx","857242159346401281",https://twitter.com/maddhattuh/status/857242159346401281
mzangeljohnson,2017-04-26 10:36,1,"@Nader723 I can't make this this shit up stay woke pic.twitter.com/Ayqsexd57J","857241973073338368",https://twitter.com/mzangeljohnson/status/857241973073338368
chetbtester,2017-04-26 10:36,0,"I learned all I know about interrogation by listening to Jack Arute interview Dick Trickle. [You can't make this shit up .]","857241875580952577",https://twitter.com/chetbtester/status/857241875580952577
Young_Hitta_J,2017-04-26 10:34,0,"I watch this , and I can't help but keep saying to myself "Buckle up , Buckaroos." Does that make me a bad person?? *South Park reference* https:// twitter.com/LateNightSeth/ status/857240855979073538 …","857241595518832640",https://twitter.com/Young_Hitta_J/status/857241595518832640
sumthnboutmary,2017-04-26 10:27,0,"A con-man President, surrounded by Con-men advisers. You can't make this shit up ! I cannot wait for the arrest of them all!! https:// twitter.com/nickkristof/st atus/857017048861483009 …","857239609499164677",https://twitter.com/sumthnboutmary/status/857239609499164677
SamanthaRamser,2017-04-26 10:25,0,"My 5th graders just asked me if I weighed 600 lbs. awesome self esteem booster. I swear I can't make this stuff up ! #sces #SLP","857239121751887872",https://twitter.com/SamanthaRamser/status/857239121751887872
Tyneshia_Love,2017-04-26 10:21,0,"Yooo I woke up to some good news I got both jobs lets it's lit . Can't wait to make this money","857238158957830144",https://twitter.com/Tyneshia_Love/status/857238158957830144
maits,2017-04-26 10:13,0,"I had to read this headline three times. You can't make this up . pic.twitter.com/ou4ai2hGDW","857236112481320960",https://twitter.com/maits/status/857236112481320960
