DrFinlayMcFin,2015-11-24 13:40,0,"@BraveFergus Fank oo Dad ! Yeah we is all muscle no fat !!","669223976112123904",https://twitter.com/DrFinlayMcFin/status/669223976112123904
__shannongates,2015-11-24 12:29,0,"being called fat is such a platonic thing for me now I'm just like yeah ok I'm fat dad so what","669206129591885824",https://twitter.com/__shannongates/status/669206129591885824
ShawnGotDatSwag,2015-11-24 11:58,0,"" Dad yu got this big ass donut where da hell is ma milk at?" like father like sons fat ass https:// instagram.com/p/-eaFJ8AkzO/","669198442997006336",https://twitter.com/ShawnGotDatSwag/status/669198442997006336
IRLdadjoke,2015-11-24 10:31,0,"I know for a fact that my dad can't be my real dad bc he thinks the garbage that made "dear fat people" is funny so I gotta go","669176620557533184",https://twitter.com/IRLdadjoke/status/669176620557533184
connorelvins,2015-11-24 08:50,0,"My dad 'if you're a girl who is fat and has short hair, you're a lesbian' loooooooool","669151169567133696",https://twitter.com/connorelvins/status/669151169567133696
maestrosyndrome,2015-11-24 07:33,0,"@aidanthebyrne on a serious note, I'm looking into fecal transplants for weight loss. I may be in touch. Is your dad fat in his old age?","669131700127993856",https://twitter.com/maestrosyndrome/status/669131700127993856
jimho,2015-11-23 22:04,0,"@JimGaffigan enjoying Dad is fat book but you should give disney another chance Maybe when kids are older or u and wife try Food&Wine fest","668988596569903105",https://twitter.com/jimho/status/668988596569903105
jesusC638,2015-11-23 21:40,0,"So dad is fat af","668982463004184576",https://twitter.com/jesusC638/status/668982463004184576
pomantini,2015-11-23 21:27,0,"by that I mean I want the book Dad Is Fat by Jim Gaffigan for Xmas :)))","668979150582063104",https://twitter.com/pomantini/status/668979150582063104
pomantini,2015-11-23 21:26,0,"DAD IS FAT FOR CHRISTMAS!!","668979045510586368",https://twitter.com/pomantini/status/668979045510586368
reneemparado,2015-11-23 21:10,0,"lol my ankle is fat and swollen and it hurts to walk and my dad said, "I'm gonna get some tape and pre wrap so you could play tmrw"","668974835641421824",https://twitter.com/reneemparado/status/668974835641421824
johnsonkelsey24,2015-11-23 20:21,0,"If there is a "No Fat Chicks" campaign promoted by Old Row maybe they should also stop promoting the " Dad Bod"","668962559974838272",https://twitter.com/johnsonkelsey24/status/668962559974838272
arickamarie,2015-11-23 19:23,0,"Which is what she said to me the last time I was kidnapped to her house running errands with my dad . "You shole is getting fat , ain't cha?"","668948132139565056",https://twitter.com/arickamarie/status/668948132139565056
SicVonDoom,2015-11-23 19:08,0,"Getting a fat paycheck and filling my dad 's truck's bed with groceries is always such a rewarding… https:// instagram.com/p/-cmbsQQxXQ/","668944132375646208",https://twitter.com/SicVonDoom/status/668944132375646208
xoterrajaex3,2015-11-23 19:06,0,"my dad told me everyone else is fat and white too so at least I get to flop around with other nasties","668943800123944960",https://twitter.com/xoterrajaex3/status/668943800123944960
gabriellalent,2015-11-23 18:41,0,"" is that fat free ice cream?" dad who do you think I am","668937513239764992",https://twitter.com/gabriellalent/status/668937513239764992
KatietotheBeth,2015-11-23 16:37,0,"When @johnjohnson_21 says his dad 's butt is " fat as fohhhh"","668906303134150656",https://twitter.com/KatietotheBeth/status/668906303134150656
fat_ima21,2015-11-23 16:34,0,"deng tomorrow is my dad 's birthday and I haven't gotten him anything :(","668905455486275584",https://twitter.com/fat_ima21/status/668905455486275584
aliciadiphda,2015-11-23 16:01,0,"ahaha my dad just called me fat and said im too heavy wjat a womdefrul day this is","668897099749003264",https://twitter.com/aliciadiphda/status/668897099749003264
desiraay_,2015-11-23 14:41,0,"My dad is so fat I hate him","668877104105164801",https://twitter.com/desiraay_/status/668877104105164801
KalKentMaes,2015-11-23 14:39,0,"My dad : you're fat you don't need to eat Me: thanks for heightening my self esteem Him: *yelling* YOURE FAT AND YOUR BUTT IS HUGE","668876548108259329",https://twitter.com/KalKentMaes/status/668876548108259329
bmcdev,2015-11-23 14:33,0,"@ForeverToxiic I thought the term was skinny fat . For men this is called the dad bod.","668875028851728384",https://twitter.com/bmcdev/status/668875028851728384
maddoodley,2015-11-23 12:32,0,"The realest OG. Is me mom and dad . Taking care of fat child ain't that ez. Big clothes more fabric more money spent. Shoutout to ma homies.","668844486009581569",https://twitter.com/maddoodley/status/668844486009581569
bethwolf1974,2015-11-23 12:22,0,"Chad long in hillview incest long is pretending his incest dick is stuck on he takes turns with fat cousin and his dad jacking off incest f","668842029850447872",https://twitter.com/bethwolf1974/status/668842029850447872
lilwoody500,2015-11-23 11:50,0,"My dad always trying to take me out to eat I swear he is trying to make me fat lol pic.twitter.com/pzBSoFsfRC","668834105757421568",https://twitter.com/lilwoody500/status/668834105757421568
MrDTomlinson,2015-11-23 11:26,0,"My family set up is strange. Go from calling my dad a fat dick head to then calling my mum a slut. This is everyday language between ys","668827940621299713",https://twitter.com/MrDTomlinson/status/668827940621299713
itsukayume,2015-11-23 04:47,0,"Dad ask mom why i look fat ... Lol... Dad , your daughter is gaining a LOT of weight staying at home..","668727450336038912",https://twitter.com/itsukayume/status/668727450336038912
SmartStudioCo,2015-11-23 03:47,1,"Gilbert Arenas' Dad -- My Son Is The Next LeBron ... Of The Movie Biz (VIDEO): Gilbert Arenas' fat ... http:// bit.ly/1P25Z2U @Amontanafm","668712560833630208",https://twitter.com/SmartStudioCo/status/668712560833630208
Amontanafm,2015-11-23 03:47,0,"Gilbert Arenas' Dad -- My Son Is The Next LeBron ... Of The Movie Biz (VIDEO): Gilbert Arenas' fat ... http:// bit.ly/1P25Z2U @Amontanafm","668712556693839872",https://twitter.com/Amontanafm/status/668712556693839872
AAE50100,2015-11-23 01:20,0,"I'm so hungry but my dad is taking me home and I know he won't feed my fat ass self","668675441142530048",https://twitter.com/AAE50100/status/668675441142530048
paveesivaa,2015-11-23 00:25,0,"Dad : did you go to the gym today? Me: yeah. Dad : you still fat though.... My dad is brighhhhht","668661669371973632",https://twitter.com/paveesivaa/status/668661669371973632
MoeGotti_UpNext,2015-11-22 22:37,0,"@ddukes_5 is that fat dad lol","668634463853744128",https://twitter.com/MoeGotti_UpNext/status/668634463853744128
everythingeman,2015-11-22 22:32,0,"My dad saw nicki and asked me if she is actually fat or looks like it and was really confused when i told him she got implats @dad wyd","668633094010765312",https://twitter.com/everythingeman/status/668633094010765312
SkeeterKudzu,2015-11-22 21:24,0,"Somewhere the dad from My Big Fat Greek Wedding is approving of their use of Windex to the eye. #TheLeftovers","668616066520739840",https://twitter.com/SkeeterKudzu/status/668616066520739840
maddym1001,2015-11-22 21:16,0,"my dad CONSTANTLY talks about how fat my mom's ass is","668613941233233920",https://twitter.com/maddym1001/status/668613941233233920
AngelaMoquin,2015-11-22 21:13,0,"*My dad as Nicki Minaj is walking up to accept her award* "She's got a huge butt honey, look at it! She should get that fat sucked out!"","668613201542512640",https://twitter.com/AngelaMoquin/status/668613201542512640
Beautybyfabiii,2015-11-22 20:45,0,"MY DAD @MS PIGGY IS TJAT FAT AMY?","668606237278343168",https://twitter.com/Beautybyfabiii/status/668606237278343168
laurenhiggins41,2015-11-22 20:40,0,"when your dad thinks fat amy is adele...","668604989628116992",https://twitter.com/laurenhiggins41/status/668604989628116992
rockinaunt,2015-11-22 20:38,0,"Dad : that beat is from another record. Mom: who is that? Dad : dunno. Mom: she looks fat . Well, her legs do. #AMAs","668604437460480000",https://twitter.com/rockinaunt/status/668604437460480000
hileenag,2015-11-22 19:20,0,"My dad has 0 chill he will fat shame someone who is anorexic","668584950547918849",https://twitter.com/hileenag/status/668584950547918849
falsettoljp,2015-11-22 19:12,0,"my step dad basically just told me I'm fat and I'm just going to keep getting fatter. This is why I have no self esteem and he wonders why","668582941564534784",https://twitter.com/falsettoljp/status/668582941564534784
strlt,2015-11-22 19:12,0,"@istatenation @KeepSawinWood Mark, I guess your grandchildren's dad is looking for a job, too! I guess the " Fat Man" is singing now!","668582831556157440",https://twitter.com/strlt/status/668582831556157440
katiepersch,2015-11-22 18:50,0,"My dad always said big and fat was is prettiest color they make. pic.twitter.com/IxiWhMv5yM","668577228846792704",https://twitter.com/katiepersch/status/668577228846792704
MrPeytonMyers,2015-11-22 18:21,1,"Eddie Lacy is a fat fuck - dad #DefendTheNorth","668570140363984896",https://twitter.com/MrPeytonMyers/status/668570140363984896
NessaaOrtiz,2015-11-22 17:08,0,"My dad swears that coffee is making me fat . Nah, son.","668551696197505024",https://twitter.com/NessaaOrtiz/status/668551696197505024
jessicablauer,2015-11-22 16:42,0,"Dad says to my brother: "Triston, just because the food is in front of you doesn't mean you should eat it.. Fat ass"","668545042303193088",https://twitter.com/jessicablauer/status/668545042303193088
cara_d11,2015-11-22 16:36,0,"Is it normal for your family to call you fat and your dad to care more about an another family then you and is it normal to feel like nothin","668543482294902785",https://twitter.com/cara_d11/status/668543482294902785
irlxxx,2015-11-22 16:11,0,"Every time my dad is home he just insults me to fuck ahaha kill ya self fat","668537330475655168",https://twitter.com/irlxxx/status/668537330475655168
seangomez0014,2015-11-22 14:48,0,"@khristianbelken @j_weer fat Jesus is at his dad 's but I'm done","668516427570257921",https://twitter.com/seangomez0014/status/668516427570257921
StuHorvath,2015-11-22 13:38,0,"@provenself The concept (what if someone can control you) is much more concise than what if a fat guy hated his dad & daredevil & ninjas &","668498792572985345",https://twitter.com/StuHorvath/status/668498792572985345
getwithannie_,2015-11-22 12:53,0,"all my dad is getting for Christmas is a big fat scowl because he turned off my music.","668487605365817344",https://twitter.com/getwithannie_/status/668487605365817344
kalimaati,2015-11-22 10:18,0,"Learning Arabic is funny sometimes. I learnt that my dad 's cousin's name literally means "she complained" and the name sameenah means fat","668448416096256000",https://twitter.com/kalimaati/status/668448416096256000
miiikaylaaaaaaa,2015-11-22 00:51,0,"My dad just said kim k is famous cause she has a fat ass and made a sex tape","668305780316106752",https://twitter.com/miiikaylaaaaaaa/status/668305780316106752
Elizaabissh,2015-11-21 23:38,0,"*asks Delaney if said boy is fat * Hm no, well yeah. A little chubs, a dad bod for sure"","668287354809905152",https://twitter.com/Elizaabissh/status/668287354809905152
kay_gelhar,2015-11-21 23:03,0,"My dad is constantly making fat jokes about me.","668278559178416128",https://twitter.com/kay_gelhar/status/668278559178416128
hailstormmm,2015-11-21 20:12,2,"" Is Amy Schumer fat or does she just look fat ?"-My Dad","668235481939750912",https://twitter.com/hailstormmm/status/668235481939750912
LisaLease007,2015-11-21 20:08,0,"The 6 is gonna like fat girls just like his dad","668234646841266176",https://twitter.com/LisaLease007/status/668234646841266176
tbhnat,2015-11-21 20:06,0,"Pls tell me y my dad is making ribs thanksgiving week like he rlly wants me to b fat","668234076369776640",https://twitter.com/tbhnat/status/668234076369776640
KendallArzu,2015-11-21 19:06,0,"@Robertorh29 I can't get fat dude. My metabolism is ridiculous. I burn calories just sitting down. My dad is still skinny af","668219011654533121",https://twitter.com/KendallArzu/status/668219011654533121