ZaQ5322,2016-01-25 21:35,0,"My dad on AJ/Jericho "AJ is great, he's always been great but Jericho is too fucking fat and too fucking old. He needs to go away."","691811568250675200",https://twitter.com/ZaQ5322/status/691811568250675200
RLnoStine,2016-01-25 19:52,0,"My dad is low key a dick rn for calling me fat earlier today then making cookies tonight.","691785798056873984",https://twitter.com/RLnoStine/status/691785798056873984
ThaQueen_919,2016-01-25 18:50,0,"All my dad orders is pizza & subs he's trying to get me fat & kill me","691770151293837313",https://twitter.com/ThaQueen_919/status/691770151293837313
TheresaSnyder19,2016-01-25 18:41,0,"@LeviCurrie @Gerizentime @Wort01 My dad is the same way, but I inherited my mom's genes. Anything I eat turns to fat .","691767880266969088",https://twitter.com/TheresaSnyder19/status/691767880266969088
fat__jesus_,2016-01-25 18:28,0,"@WzzlyGntergeen i feel like this is would be ur dad 10 years ago lol https:// twitter.com/guycodes/statu s/691761224984453120 …","691764726666285057",https://twitter.com/fat__jesus_/status/691764726666285057
Stuey_95,2016-01-25 18:13,1,"Rooney you're a fat mess, Mata you're a blogger not a baller, Januzaj is a lesbian, Memphis your dad realised you're a disappoint and left","691760763711668225",https://twitter.com/Stuey_95/status/691760763711668225
tinderfails_,2016-01-25 17:30,0,"Jokes on you, my dad is fat - for more -> http:// dlmyfile.com/r/166/ #tinder #fails #humor pic.twitter.com/zNTo0SRg3h","691750048728793090",https://twitter.com/tinderfails_/status/691750048728793090
AnnikaSharma,2016-01-25 17:18,0,"Family thread: Bro (5'10", 140 lbs): trainer says body fat is high. Me (5'3", a lot heavier): wow I must be a whale. Dad : father whale here.","691747046349406208",https://twitter.com/AnnikaSharma/status/691747046349406208
zach_who30,2016-01-25 15:31,0,"Your momma is so fat your dad left her.","691720007726796801",https://twitter.com/zach_who30/status/691720007726796801
LTB0NES_,2016-01-25 13:59,0,"I look in the mirror like ugh fat slob, then I ask my dad for a chocolate bar. Not sure this is how it works...","691696944037629952",https://twitter.com/LTB0NES_/status/691696944037629952
andmieuxrock,2016-01-25 11:35,0,"@KaeseolinSweeza her dad is handsome and his body is not fat . yoona's legs so pretty","691660622921089024",https://twitter.com/andmieuxrock/status/691660622921089024
Cayden__22,2016-01-25 10:08,0,"Lol my dad is sending me pics of is old girlfriend saying how fat she's gotten","691638671322148864",https://twitter.com/Cayden__22/status/691638671322148864
MackTheSpoon402,2016-01-25 09:49,0,"Dad : Is he changing lanes? Mom: No, he's just fat . #qet @Doritos #Israel pic.twitter.com/PNyahmROFe","691634014688546816",https://twitter.com/MackTheSpoon402/status/691634014688546816
DomMerlo,2016-01-25 08:23,0,"@ARWeebl The only thing that would make today better is if my dad could come out of his slum in Ingram and take a fat shit on my bed.","691612272335142912",https://twitter.com/DomMerlo/status/691612272335142912
TheCville29,2016-01-25 07:19,0,"@JimGaffigan Note from eight year old daughter found on leftovers in fridge. #snackblock #dadisfat pic.twitter.com/U8146IWSer","691596283849654272",https://twitter.com/TheCville29/status/691596283849654272
_youcango,2016-01-25 07:14,0,"but, guess what? my dad , of course. being who he fucking is . tells me I'm gaining weight and that I'm fat . what da fuq","691595032093065216",https://twitter.com/_youcango/status/691595032093065216
Daniel36580017,2016-01-25 06:55,1,"@RC1023FM , #ladyoMary , i love my coffee buh my dad says it has some side effects ,example some 1 who is not fat shuldnt take dat","691590276079443968",https://twitter.com/Daniel36580017/status/691590276079443968
ellzthelephant,2016-01-25 05:29,28,"Tracey beaker pregnant wi her first child I bet you fat duke the chef is the dad","691568503040692224",https://twitter.com/ellzthelephant/status/691568503040692224
AhMaD_hiLmieS,2016-01-25 04:14,0,"Hahahahahahaha dad just discretely said that mom is fat now kena cubit telinga","691549692467892224",https://twitter.com/AhMaD_hiLmieS/status/691549692467892224
Samantha_Goble,2016-01-25 02:06,0,"What?! Steve's dad is in with Wo Fat ?! Kaye is in with him too!? What is going on?! #HawaiiFive0","691517592985432064",https://twitter.com/Samantha_Goble/status/691517592985432064
outcast_otaku,2016-01-25 01:27,0,"My brother is becoming like my dad a fat guy that eats everything and makes weird sounds when he eats and can't even control his own farts","691507633665081344",https://twitter.com/outcast_otaku/status/691507633665081344
shuhdarruh,2016-01-24 22:57,0,""She doesn't look as juicy. Like her face isn't as fat ." Someone come get my dad while we watch this, because his commentary is too much","691469938532352001",https://twitter.com/shuhdarruh/status/691469938532352001
aricrod,2016-01-24 22:51,0,"Why is mike and Molly funny: because they're fat - American dad","691468365769015296",https://twitter.com/aricrod/status/691468365769015296
Damnitsaleks,2016-01-24 21:21,0,"My dad is calling my cat a fat turkey","691445799515922432",https://twitter.com/Damnitsaleks/status/691445799515922432
AustinAztec,2016-01-24 21:01,0,"@SlNATRA_ @dRaStiX_dX @JustChelin_ haha Sinatra is a fat fuck 21 year old that lives with his dad I'm done ️ you aren't good at anything","691440640979107843",https://twitter.com/AustinAztec/status/691440640979107843
ianinthefuture,2016-01-24 20:43,0,"Or the Usos should go for six months, and when they come back one of them is as fat as their dad , and he's called Rikishi 2.","691436172229398528",https://twitter.com/ianinthefuture/status/691436172229398528
PNW_Hawk,2016-01-24 20:41,0,"That is a fat man. It's Eddie Lacy's dad .","691435674935799808",https://twitter.com/PNW_Hawk/status/691435674935799808
FunderburgMike,2016-01-24 20:03,0,"Even my dad is calling me fat now","691426050719395840",https://twitter.com/FunderburgMike/status/691426050719395840