username, date, retweets, text, id, permalink
MarceyRader,2017-04-28 19:55,0,"5 of 5 stars to Born a Crime by Trevor Noah https:// goodreads.com/review/show/18 80589405 …","858107376695750657",https://twitter.com/MarceyRader/status/858107376695750657
tishapascual,2017-04-28 19:36,0,"@Trevornoah if you see a small asian girl running around DPAC with a book in her hand, it's me and I want my copy of Born A Crime signed pls","858102672972537857",https://twitter.com/tishapascual/status/858102672972537857
ummy_yah,2017-04-28 19:04,0,"@diyatiti audio book for born a crime . Got it? https:// twitter.com/iabbati_/statu s/858089970346733569 …","858094696744275968",https://twitter.com/ummy_yah/status/858094696744275968
BossyDyme,2017-04-28 19:01,0,"Just finished my Trevor Noah book Born A Crime !! I loved it soooo much! What am I suppose 2 do now!!! @Trevornoah pic.twitter.com/ybHKSKf9GR","858093872395714560",https://twitter.com/BossyDyme/status/858093872395714560
ummy_yah,2017-04-28 18:20,1,"Have you read his Born A Crime ? https:// twitter.com/shah_rhon/stat us/858073161270800384 …","858083609256878080",https://twitter.com/ummy_yah/status/858083609256878080
MarceyRader,2017-04-28 18:18,0,"5 of 5 stars to Born a Crime by Trevor Noah https://www. goodreads.com/review/show?id =1880589405 …","858083131252932609",https://twitter.com/MarceyRader/status/858083131252932609
anat_deracine,2017-04-28 17:20,0,"@Trevornoah 's Born a Crime may be the most important book I've read this decade. It should be taught in schools. Those dimples are strength.","858068335321165824",https://twitter.com/anat_deracine/status/858068335321165824
amandadavisart,2017-04-28 17:05,0,"Learning and Laughing Always a great combo. Thanks @Trevornoah ! #bornacrime #fridayreads #amreading pic.twitter.com/OxdT7G6vEf","858064577241776128",https://twitter.com/amandadavisart/status/858064577241776128
abrahamnm,2017-04-28 16:44,0,"4 of 5 stars to Born a Crime by Trevor Noah https://www. goodreads.com/review/show?id =1956707258 …","858059445464698880",https://twitter.com/abrahamnm/status/858059445464698880
jennymcjennface,2017-04-28 16:32,0,"How can someone who wrote a book " Born a Crime ", have the guts to bitch about his host country that made him rich??","858056287116034049",https://twitter.com/jennymcjennface/status/858056287116034049
fishgrrl,2017-04-28 16:25,0,"So excited to start listening to this!! #midhudsonlibrarysystem @Trevornoah #bornacrime pic.twitter.com/VrHDkwUl5y – bei Stone Ridge Public Library","858054606504570880",https://twitter.com/fishgrrl/status/858054606504570880
kathrynelspeth,2017-04-28 16:08,0,"So excited to be seeing @Trevornoah tonight @DPAC . I read #BornACrime in one day & recommended it at work. pic.twitter.com/9JCMhGFKtD","858050331565010945",https://twitter.com/kathrynelspeth/status/858050331565010945
AtoZBookClub,2017-04-28 15:24,1,"Born a Crime : Stories From a South African Childhood - Trevor Noah https://www. goodreads.com/book/show/2978 0253-born-a-crime?ac=1&from_search=true …","858039289166344192",https://twitter.com/AtoZBookClub/status/858039289166344192
citizenmundial,2017-04-28 15:16,0,". @Trevornoah am trying to find other books like yours to fill the void in my life since finishing #bornacrime . Any recommendations?","858037176944259073",https://twitter.com/citizenmundial/status/858037176944259073
BombaNzuzi,2017-04-28 15:07,0,"@Trevornoah I hope that I'll sell more than @born_a_crime","858034978667606017",https://twitter.com/BombaNzuzi/status/858034978667606017
MamzelleNubiana,2017-04-28 15:06,0,"Just finished listening to the audio book #BornACrime What a life! What a mother! Si vous avez 1 livre à écouter... (celui-ci s'écoute!)","858034603289960448",https://twitter.com/MamzelleNubiana/status/858034603289960448
morganmsim,2017-04-28 15:04,0,"#BornACrime is a FANTASTIC meditation on growing up biracial & multilingual (& poor & mischievous) Thx @Trevornoah for my fav read this year","858034299945275393",https://twitter.com/morganmsim/status/858034299945275393
amtrekker,2017-04-28 14:57,0,"I just finished listening to Born a Crime by Trevor Noah. Really good and not at all what I expected. Totally worth checking out.","858032511104016384",https://twitter.com/amtrekker/status/858032511104016384
sarah_shahine,2017-04-28 14:33,0,"inspired by that crime of a guy @Trevornoah <S<S http:// titleduntitled.blogspot.com.eg/2017/02/to-hum ans-and-humans-only.html … #TheDailyShow #trevorNoah #bornacrime #humanity #humancrisis #PNL","858026320822980608",https://twitter.com/sarah_shahine/status/858026320822980608
BuyBookstore,2017-04-28 13:41,1,"Born a Crime : Stories from a South African Childho http://www. ebooknetworking.net/books_detail-0 399588175.html … #bookworm #saturdaylive","858013193716629504",https://twitter.com/BuyBookstore/status/858013193716629504
JMatthewLara,2017-04-28 13:34,0,"Listening to @Trevornoah 's #bornacrime and it's incredible. I'm crying laughing.","858011506918686720",https://twitter.com/JMatthewLara/status/858011506918686720
pliyaaa,2017-04-28 13:01,0,"Moved beyond measure by @Trevornoah s #BornACrime The praise below is so mild for a debut this stupendously mind-blowing#SoAwedByHisKindness pic.twitter.com/8xSUnQ7xX1","858003319922479104",https://twitter.com/pliyaaa/status/858003319922479104
jonjeffryes,2017-04-28 11:35,0,"Born A Crime by Trevor Noah #fridayreads","857981723367403520",https://twitter.com/jonjeffryes/status/857981723367403520
haP65,2017-04-28 11:28,0,"Amen, Trevor. Wish the same for you and your fabulous, Born A Crime .","857979957011677184",https://twitter.com/haP65/status/857979957011677184
Elimgray,2017-04-28 11:01,0,"#currentlyreading Tell My Sons & Born a Crime .","857973095029669888",https://twitter.com/Elimgray/status/857973095029669888
FelixDonBash,2017-04-28 10:32,0,"@Trevornoah 's Born a Crime is too too awesome","857965810635157504",https://twitter.com/FelixDonBash/status/857965810635157504
TriniCapini,2017-04-28 10:15,1,"Trying to remember who recommended Born a Crime (audio) to me. Enjoying it so far!","857961531442647041",https://twitter.com/TriniCapini/status/857961531442647041
JimmyRay_Purser,2017-04-28 09:20,0,"My wife recommend Trevor Noah's book; " Born A Crime " to me. She is right! Man alive is that an excellent book! Highly recommended #Moms","857947713677266944",https://twitter.com/JimmyRay_Purser/status/857947713677266944
laurathomas61,2017-04-28 09:01,0,"Friday Check-In – Born a Crime by Trevor Noah https:// quinnsbooknook.com/2017/04/28/fri day-check-born-crime-trevor-noah/ … via @Quinn0611","857942975585890304",https://twitter.com/laurathomas61/status/857942975585890304
plaguemonkey1,2017-04-28 07:48,0,"Just finished Born a Crime @Trevornoah . Great read. Finished it in 2 days which is the equivalent of me running 100m faster than Usain Bolt","857924368395112452",https://twitter.com/plaguemonkey1/status/857924368395112452
jessmcculloch,2017-04-28 04:08,0,"4 of 5 stars to Born a Crime by Trevor Noah https:// goodreads.com/review/show/19 75515064 …","857868989292314624",https://twitter.com/jessmcculloch/status/857868989292314624
kaleskorner,2017-04-28 01:16,0,"On page 145 of 304 of Born a Crime , by Trevor Noah: I am learning so much right now. https:// goodreads.com/user_status/sh ow/129918274 …","857825791354310656",https://twitter.com/kaleskorner/status/857825791354310656
graphic_ks,2017-04-28 00:54,0,"Just finished @Trevornoah book #bornacrime love!","857820283620777985",https://twitter.com/graphic_ks/status/857820283620777985
missbespoke,2017-04-28 00:28,0,"❝Failure is an answer. Rejection is an answer. Regret is an eternal question you will never have the answer to.❞ @TrevorNoah #BornACrime","857813683984105472",https://twitter.com/missbespoke/status/857813683984105472
sandybeach28,2017-04-27 22:22,0,"I just finished Born A Crime by @Trevornoah . A gorgeous, funny, unimaginable, unnerving, life tale during apartheid I won't soon forget!","857782026249883648",https://twitter.com/sandybeach28/status/857782026249883648
KirBaeLicious,2017-04-27 19:48,0,"Born a crime by @Trevornoah is an amazing book","857743354972581889",https://twitter.com/KirBaeLicious/status/857743354972581889
KrajnakPeter,2017-04-27 19:25,0,"Audible book Born a Crime by Trevor Noah. 10/10","857737403020259328",https://twitter.com/KrajnakPeter/status/857737403020259328
MelRiaCarLite,2017-04-27 19:24,0,"Currently listening to Born a Crime by @Trevornoah","857737152200929280",https://twitter.com/MelRiaCarLite/status/857737152200929280
VasuMPH,2017-04-27 18:49,2,"Beautiful. 10 absolutely brilliant lessons from #BornACrime autobiography by @Trevornoah https://www. entrepreneur.com/article/288326 ?utm_source=feedburner&utm_medium=feed&utm_campaign=Feed%3A+entrepreneur%2Flatest+%28Entrepreneur%29 …","857728326793822208",https://twitter.com/VasuMPH/status/857728326793822208
Ayanda_dlams,2017-04-27 17:59,0,""The monk who sold his Ferrari" 1 day i will have the strength to finish you " Born a crime " just couldnt wait","857715870012977152",https://twitter.com/Ayanda_dlams/status/857715870012977152
noahwags,2017-04-27 16:38,0,"5 of 5 stars to Born a Crime by Trevor Noah https:// goodreads.com/review/show/18 25629213 …","857695563088879618",https://twitter.com/noahwags/status/857695563088879618
AndiswaLinda,2017-04-27 15:16,0,"Currently reading Trevor Noah's Born A Crime . It's a sad book but I'm in stitches","857674752793694209",https://twitter.com/AndiswaLinda/status/857674752793694209
AmnestyCalgary,2017-04-27 15:12,0,"Up next on our reading list: Trevor Noah's " Born a Crime " stay tuned for book club updates,… https://www. instagram.com/p/BTZmujHF-y3/","857673924787798016",https://twitter.com/AmnestyCalgary/status/857673924787798016
paperplatesblog,2017-04-27 14:22,1,"Settle in for a throwback listening session with this playlist, curated from artists in @Trevornoah 's BORN A CRIME . http:// bit.ly/2plKIYG","857661155543789568",https://twitter.com/paperplatesblog/status/857661155543789568
kaleskorner,2017-04-27 14:18,0,"On page 15 of 304 of Born a Crime , by Trevor Noah: I can already tell I am going to enjo... https:// goodreads.com/user_status/sh ow/129866930 …","857660303517114369",https://twitter.com/kaleskorner/status/857660303517114369
RAD_saint,2017-04-27 13:17,0,"@Trevornoah Born a Crime is such an amazing look into your life. I see my son's face on many of your stories and it gives me hope 4 him","857644981628149761",https://twitter.com/RAD_saint/status/857644981628149761
timmy_ny,2017-04-27 12:36,3,"My Sister really knows me. Thanks for the hook up. #BornACrime pic.twitter.com/sg9lYuCvDD","857634582463733760",https://twitter.com/timmy_ny/status/857634582463733760
colldev00,2017-04-27 12:22,0,"I'll second Noah's Born a Crime & also suggest Candice Millard's HERO OF THE EMPIRE read by Simon Vance #AskALibrarian","857631057637761024",https://twitter.com/colldev00/status/857631057637761024
MansRichPL,2017-04-27 12:12,0,"Trevor Noah's Born a Crime is pretty amazing... #AskALibrarian","857628542615654401",https://twitter.com/MansRichPL/status/857628542615654401
lanre_nova,2017-04-27 12:09,0,"Comfort provides a floor but also a ceiling #bornacrime","857627867311747072",https://twitter.com/lanre_nova/status/857627867311747072
TomJawetz,2017-04-27 11:43,0,". @Trevornoah , look. More children Born a Crime ! https:// twitter.com/latimesnationa l/status/857472901942988801 …","857621355390533636",https://twitter.com/TomJawetz/status/857621355390533636
Peady,2017-04-27 11:37,0,"Wasn't " Born a Crime " excellent, Erica?","857619816957530112",https://twitter.com/Peady/status/857619816957530112
FyreByrde,2017-04-27 10:52,0,"Btw, if you would like an insider look into Apartheid from a POC, maybe pick up a copy of @Trevornoah 's book ' Born a Crime '","857608368646746112",https://twitter.com/FyreByrde/status/857608368646746112
WordsByMxo,2017-04-27 10:30,0,"Born a crime Not readying anything currently preparing for exams nje https:// twitter.com/MissAbiKinz/st atus/857601238799699969 …","857602908241752066",https://twitter.com/WordsByMxo/status/857602908241752066
Juan_Catorce,2017-04-27 10:08,0,"Just finished Born a Crime by @Trevornoah brilliant, highly recommended","857597199756271617",https://twitter.com/Juan_Catorce/status/857597199756271617
MakukuleZamo,2017-04-27 08:08,0,"Trevor Noah's book Born a crime is so hilarious. I'm laughing with tears in my eyes. Such a wonderful story teller he is","857567098410868736",https://twitter.com/MakukuleZamo/status/857567098410868736
msizijames,2017-04-27 07:48,0,"Just finished @Trevornoah 's Born a crime . What a great read. Big up to the big man","857562086754353152",https://twitter.com/msizijames/status/857562086754353152
vvaniushka,2017-04-27 07:47,0,"Audiobook, Born a crime by Trevor Noah. Podcast, Dear Hank&John or New York Public Library","857561763813961728",https://twitter.com/vvaniushka/status/857561763813961728
ajfoster527,2017-04-27 06:52,0,"Finished reading @Trevornoah book BORN A CRIME powerful inspirational and insightful stories... has been thru a lot and his mom is amazing","857548075170242561",https://twitter.com/ajfoster527/status/857548075170242561
iHeartTshego,2017-04-27 02:57,0,"" Born A Crime " by Trevor Noah is taking over my morning pic.twitter.com/Ctyc794v38","857488800574033920",https://twitter.com/iHeartTshego/status/857488800574033920
janetlove88,2017-04-27 00:41,1,"Couldn't agree more @Trevornoah . This book is incredible, thank you for sharing your story with the world #BornaCrime pic.twitter.com/LjHTFSmg9c","857454694720876544",https://twitter.com/janetlove88/status/857454694720876544
johnny_five_o,2017-04-26 21:17,0,"4 of 5 stars to Born a Crime by Trevor Noah https://www. goodreads.com/review/show?id =1971982822 …","857403249812484096",https://twitter.com/johnny_five_o/status/857403249812484096
LizzWilk,2017-04-26 20:12,0,"A3: Listening to Trevor Noah's Born a Crime . Laugh out loud funny in parts. Poignant in others. #SpoonieChat","857386990836355073",https://twitter.com/LizzWilk/status/857386990836355073
JeancarlaR,2017-04-26 19:40,0,"Born a Crime by Trevor Noah and Diane Guerreros book called in the country we love!","857378881942278144",https://twitter.com/JeancarlaR/status/857378881942278144
kfina_20,2017-04-26 19:27,0,"Born A Crime : Noah grew up under apartheid, his own birth was illegal. Now he is very successful, cultivating awareness about racism today.","857375515828776964",https://twitter.com/kfina_20/status/857375515828776964
darroyo3,2017-04-26 19:24,0,"Born a Crime by Trevor Noah...it's amazing","857374781292892160",https://twitter.com/darroyo3/status/857374781292892160
MsVane22,2017-04-26 18:43,0,"@Trevornoah I'm finally reading #bornacrime Excellent read! Well done. I've been recommending it to everyone!","857364620532731905",https://twitter.com/MsVane22/status/857364620532731905
katenderu,2017-04-26 16:22,0,"Born a crime is done and dusted. What a story.","857329146061520897",https://twitter.com/katenderu/status/857329146061520897
GlenPubLib,2017-04-26 14:31,0,"What have you been reading lately? We've been enjoying ' Born a Crime ' by @Trevornoah http:// bit.ly/2oKe0y9 pic.twitter.com/7xcsuPcIFe","857301021785280516",https://twitter.com/GlenPubLib/status/857301021785280516
Angelized_1st,2017-04-26 13:01,0,"Audio Review: Born a Crime : Stories from a South African Childhood by Trevor Noah http://www. iwasangelized1st.com/2017/04/audio- review-born-a-crime-stories-from-a-south-african-childhood-by-trevor-noah/ …","857278582607015936",https://twitter.com/Angelized_1st/status/857278582607015936
Vutivi_M,2017-04-26 11:27,0,"I shed a tear reading last part of @Trevornoah 's book Born A Crime - My Mother's Life. What he went through b/c of Abel was too much","857254911817515012",https://twitter.com/Vutivi_M/status/857254911817515012
beforelately,2017-04-26 10:56,0,"35% done with Born a Crime , by Trevor Noah https:// goodreads.com/user_status/sh ow/129748786 …","857247098563067904",https://twitter.com/beforelately/status/857247098563067904
missforson,2017-04-26 10:44,1,"#bornacrime #trevornoah pic.twitter.com/ih086oPZ8M","857244066878296066",https://twitter.com/missforson/status/857244066878296066
Skrong_,2017-04-26 07:49,0,"@ClarkHighland You've been quoted in my #Storify story "Trevor Noah Born a Crime " https:// storify.com/Aajac5/getting -started …","857199930032758784",https://twitter.com/Skrong_/status/857199930032758784
trebla233,2017-04-26 06:06,0,"@Trevornoah Born a Crime was such a brilliant read.it was so easy to relate to the stories from an African home.Comical and Eloquently A+.","857173963138576385",https://twitter.com/trebla233/status/857173963138576385
justinjleung,2017-04-26 05:32,0,"(3) although comedic in nature, " Born A Crime " is deeply insightful. Covers apartheid, poverty, misogyny, race, domestic abuse, parenting..","857165477273108481",https://twitter.com/justinjleung/status/857165477273108481
justinjleung,2017-04-26 05:27,0,"(1) Just finished @Trevornoah 's book " Born A Crime " Stories from a South African Childhood on @audible_com . Don't say this often, but this","857164230168104960",https://twitter.com/justinjleung/status/857164230168104960
midwest_darling,2017-04-26 04:31,0,"Born a Crime by Trevor Noah Should Be Next On Your Reading List https://www. bloglovin.com/blogs/midwest- darling-12909031/born-a-crime-by-trevor-noah-should-be-next-5596750079 … on @bloglovin","857150136627187712",https://twitter.com/midwest_darling/status/857150136627187712
midwest_darling,2017-04-26 04:15,0,"Born a Crime by Trevor Noah Should Be Next On Your Reading List http://www. midwestdarling.com/born-a-crime-b y-trevor-noah-should-be-next-on-your-reading-list/ … pic.twitter.com/9l1XdbdhTD","857146098351263745",https://twitter.com/midwest_darling/status/857146098351263745
AmandaIliva,2017-04-26 01:31,5,"The excitement is real! #BornACrime #TrevorNoah pic.twitter.com/Joimp6DDeQ","857104853499293696",https://twitter.com/AmandaIliva/status/857104853499293696
FelixDonBash,2017-04-26 00:31,0,"A good morning to listen to Born a crime pic.twitter.com/UDddHtighO","857089718881837056",https://twitter.com/FelixDonBash/status/857089718881837056
FitOshkoshInc,2017-04-25 23:54,0,"Announcement: In partnership with the UW Oshkosh Women's Center, our next Color-Brave Community Read: Born a Crime ! pic.twitter.com/BuSCfHBaA8","857080323808661504",https://twitter.com/FitOshkoshInc/status/857080323808661504
MRSGLAUBERMAN,2017-04-25 23:07,0,"Met a Cute White Guy (Prequel to Born A Crime ) #BadBookPrequels @midnight @Trevornoah","857068694354219008",https://twitter.com/MRSGLAUBERMAN/status/857068694354219008
captainfoxbutt,2017-04-25 22:56,0,"Born a crime by Trevor Noah. Phenomenal","857065934678368256",https://twitter.com/captainfoxbutt/status/857065934678368256
niecy281,2017-04-25 22:51,0,"@Trevornoah See you in Seattle @Paramount...Loved, " Born A Crime ."","857064616941113344",https://twitter.com/niecy281/status/857064616941113344
honsololam,2017-04-25 22:43,0,"The lecture from @Trevornoah mom before church every Sunday #BornaCrime pic.twitter.com/9VrV0HU46k","857062446741291008",https://twitter.com/honsololam/status/857062446741291008
RitikaTrikha,2017-04-25 22:02,0,"33% done with Born a Crime , by Trevor Noah https:// goodreads.com/user_status/sh ow/129699564 …","857052197640691712",https://twitter.com/RitikaTrikha/status/857052197640691712
magnuslghtwoods,2017-04-25 21:42,0,"i can't wait to finally get to Born A Crime ! i've recently started watching Trevor Noah!","857047242397634560",https://twitter.com/magnuslghtwoods/status/857047242397634560
TBRetc,2017-04-25 21:40,0,"The Hate U Give, A Little Life, Born A Crime , & The Girl Before. #BHPChat","857046779031957504",https://twitter.com/TBRetc/status/857046779031957504
Bniels1,2017-04-25 21:27,0,"@Trevornoah I now finished #bornacrime and the US does not deserve you (but we need you, dont go) and your mother's courage gives me chills","857043539749990400",https://twitter.com/Bniels1/status/857043539749990400
ElisaInOly,2017-04-25 21:19,0,"Just finished the @Trevornoah audiobook #BornaCrime . ♡ It was mainly about what a strong, smart, kick-ass mom he has. #feminism #girlpower","857041426852438016",https://twitter.com/ElisaInOly/status/857041426852438016
brittybap,2017-04-25 20:05,0,"I am loving Born a Crime "We tell people to follow their dreams, but you can only dream of what you can imagine..." @Trevornoah #goodreads","857022757925683201",https://twitter.com/brittybap/status/857022757925683201
Today_OnThe_Web,2017-04-25 19:30,0,"Check out Born a Crime : Stories from a South African Childhood (Hardcover) by Trevor Noah http://www. ebay.com/itm/Born-a-Cri me-Stories-from-a-South-African-Childhood-Hardcover-by-Trevor-Noah-/361826595620?roken=cUgayN&soutkn=5YsnEO … via @eBay","857014065146843137",https://twitter.com/Today_OnThe_Web/status/857014065146843137
henrygreen,2017-04-25 17:27,0,""Love is a creative act." ~ Trevor Noah: Born A Crime","856983128237371398",https://twitter.com/henrygreen/status/856983128237371398
njerimarz,2017-04-25 16:30,0,"Born a crime is hilarious. Being accused of murder by lightning and other stories","856968741824942081",https://twitter.com/njerimarz/status/856968741824942081
CCBenji116,2017-04-25 16:18,0,"#Random662 Today, this evening even, I finished reading Trevor Noah's Born A Crime in the shuttle bus that was... http:// fb.me/yYIhT0td","856965693010579456",https://twitter.com/CCBenji116/status/856965693010579456
SugaryOblivion,2017-04-25 14:57,1,"49. @MissZini ' Born a Crime ' - Trevor Noah. (On my To Be Read list.) pic.twitter.com/QxWoMF9Y2U","856945304440057856",https://twitter.com/SugaryOblivion/status/856945304440057856
MrNarci,2017-04-25 14:45,0,"On page 80 of 288 of Born a Crime , by Trevor Noah https:// goodreads.com/user_status/sh ow/129661027 …","856942288387411968",https://twitter.com/MrNarci/status/856942288387411968
BirdsEyeFoto,2017-04-25 14:15,0,"Wish I could spend the rest of the day reading @Trevornoah 's #BornACrime all day. Nighttime can't come soon enough.","856934671476707328",https://twitter.com/BirdsEyeFoto/status/856934671476707328
IyerOnFire_,2017-04-25 13:17,0,"Been a while since I read something as amazing as @Trevornoah 's #BornACrime . There will be more books by him, yes?","856920104348655616",https://twitter.com/IyerOnFire_/status/856920104348655616
Somebiii_,2017-04-25 12:47,0,"As I read this born a crime book, I fall more in love( with Trevor Noah","856912618577121280",https://twitter.com/Somebiii_/status/856912618577121280
MrHecklesTwin,2017-04-25 12:13,0,"Bought @Trevornoah book #bornacrime not even two days ago, finished this am. Best read in a long time pic.twitter.com/Le0pBNmgp1","856904106849456128",https://twitter.com/MrHecklesTwin/status/856904106849456128
foundrymedia,2017-04-25 11:01,0,"@TrevorNoah , author of BORN A CRIME , is on tour! Get tickets to see him in your city: http:// bit.ly/1IJJ6us","856885857705484288",https://twitter.com/foundrymedia/status/856885857705484288
PamReneeLukas,2017-04-25 10:44,0,"@Trevornoah - reading (& loving) Born A Crime . I think we share the same mom. Fierce & slightly crazy. https:// twitter.com/trevornoah/sta tus/798628857288990720 …","856881722214014976",https://twitter.com/PamReneeLukas/status/856881722214014976
paperplatesblog,2017-04-25 10:27,1,"new post >> " Born a Crime " — A literary soundtrack http:// bit.ly/2p0xguT pic.twitter.com/ba2qVlmxoF","856877222271082499",https://twitter.com/paperplatesblog/status/856877222271082499
tamiestevens,2017-04-25 08:58,0,"Now reading: @trevornoah " Born A Crime ". I love how honest and raw he is in sharing his… https://www. instagram.com/p/BTTyay7j-E4/","856855036579762176",https://twitter.com/tamiestevens/status/856855036579762176
bababaike,2017-04-25 08:57,0,"ゴーンガール読み終えたので、勢いに乗ってるうちにまた英語の本読み始めようと思ってトレバー・ノアの born a crime 買っちゃった。頑張ろう。","856854625537867776",https://twitter.com/bababaike/status/856854625537867776
TeliseTheSwede,2017-04-25 06:01,0,"Just started reading #BornaCrime and aaaah it's so damn good. The minibus descriptions brought me right back to my 4 months in SA.","856810369016369152",https://twitter.com/TeliseTheSwede/status/856810369016369152
NICRO_,2017-04-25 05:35,1,"#LessonsFromTrevor #TrevorNoah #BornACrime #NICRO http:// fb.me/1TDtk3l7u","856803750735990784",https://twitter.com/NICRO_/status/856803750735990784
tanvirivnat,2017-04-25 04:17,1,"Ah Trevor Noah's narration! Absolute treat! — listening to Born a Crime - Stories from a South African Childhood.","856784194369748992",https://twitter.com/tanvirivnat/status/856784194369748992
sldowney,2017-04-24 23:53,0,"4 of 5 stars to Born a Crime by Trevor Noah https:// goodreads.com/review/show/19 50146598 …","856717709194788865",https://twitter.com/sldowney/status/856717709194788865
anne_most,2017-04-24 23:35,0,"Me reading the last chapter of @Trevornoah 's book #BornACrime ...I Matthew Mcconaughey ugly cried pic.twitter.com/cTYmz4uyz1","856713365573566465",https://twitter.com/anne_most/status/856713365573566465
KaGaCa,2017-04-24 22:52,0,"@Trevornoah his book #BornaCrime #theNSLS @devry","856702411183927296",https://twitter.com/KaGaCa/status/856702411183927296
JustKelso,2017-04-24 22:16,0,"Enjoying @Trevornoah ' Born A Crime ' called my mom to tell her how much I love her after reading it.","856693440637280256",https://twitter.com/JustKelso/status/856693440637280256
mcrlyric_bot,2017-04-24 21:49,3,"You were always born a crime We salute you in your grave","856686512355778561",https://twitter.com/mcrlyric_bot/status/856686512355778561
Kristelh84,2017-04-24 21:35,0,"4 of 5 stars to Born a Crime by Trevor Noah https://www. goodreads.com/review/show?id =1861485727 …","856683015124250624",https://twitter.com/Kristelh84/status/856683015124250624
