Whipped_Crim_54,2017-04-16 05:21,0,"I just died #GoHitler #BornACrime @Trevornoah u r too hilarious!!!! pic.twitter.com/F44MCI9sj8","853538848265187329",https://twitter.com/Whipped_Crim_54/status/853538848265187329
Mistar_Chuka,2017-04-16 04:58,0,"Born a crime https:// twitter.com/Rayyshie/statu s/853529920978505728 …","853533123178631168",https://twitter.com/Mistar_Chuka/status/853533123178631168
Whipped_Crim_54,2017-04-16 04:48,3,"Y th education system in SA needs to change #BornACrime pic.twitter.com/r6UHOKYgX5","853530515537883138",https://twitter.com/Whipped_Crim_54/status/853530515537883138
Misslamide,2017-04-16 04:33,0,"Trevor Noah's Born a crime is the only African literature I've read this year. I'm so ashamed","853526766752849920",https://twitter.com/Misslamide/status/853526766752849920
heyharmony,2017-04-16 00:17,0,"oh! Since you like podcasts, Elliott and I are LOVING the audiobook Born A Crime , by Trevor Noah. It's narrated by him so good","853462439123341312",https://twitter.com/heyharmony/status/853462439123341312
mingong75,2017-04-16 00:01,0,"Born a Crime Audiobook Trevor Noah Audiobook https:// youtu.be/6M4gGEidaNI via @YouTube","853458391611482113",https://twitter.com/mingong75/status/853458391611482113
german_sale,2017-04-15 22:48,0,"Englische Bücher: #9: Born a Crime : Stories from a South African Childhood http:// ift.tt/2l5okTX …","853439850695065600",https://twitter.com/german_sale/status/853439850695065600
dianalimongi,2017-04-15 22:29,0,"I can't wait to read @Trevornoah 's born a crime !","853435146472759297",https://twitter.com/dianalimongi/status/853435146472759297
MusoffWill,2017-04-15 22:13,0,"@Trevornoah is hilarious... "it was like game of thrones but with poor ppl" #bornacrime","853431229475172353",https://twitter.com/MusoffWill/status/853431229475172353
DenzilJS,2017-04-15 20:56,0,"@Trevornoah #BornACrime is excellent but you didn't explain what happened to Teddy after expulsion. Last chapter an absolute #pageturner !","853411625025458177",https://twitter.com/DenzilJS/status/853411625025458177
phepp89,2017-04-15 20:08,0,""" BORN A CRIME ""","853399741761077248",https://twitter.com/phepp89/status/853399741761077248
thatfuturedvm,2017-04-15 19:52,0,"I know I'm a little late to the game but holy wow @Trevornoah 's " Born a Crime " is absolutely wonderful. Patricia Noah is a phenomenal woman","853395551185928192",https://twitter.com/thatfuturedvm/status/853395551185928192
dypherent3000,2017-04-15 19:17,0,"Born a Crime , Trevor Noah. https:// play.google.com/store/books/de tails?id=N97UCwAAQBAJ …","853386813670477824",https://twitter.com/dypherent3000/status/853386813670477824
johnny_five_o,2017-04-15 18:38,0,"On page 95 of 288 of Born a Crime , by Trevor Noah https:// goodreads.com/user_status/sh ow/128643155 …","853377053466525696",https://twitter.com/johnny_five_o/status/853377053466525696
squarie,2017-04-15 17:05,0,"Been listening to " Born a Crime " on my bike rides. Even better with @trevornoah reading it himself.","853353533550325760",https://twitter.com/squarie/status/853353533550325760
Joy2th3worldd,2017-04-15 16:57,0,"Finished " Born A Crime ". Definitely recommend!","853351612114448384",https://twitter.com/Joy2th3worldd/status/853351612114448384
shaktifiedOm,2017-04-15 14:43,1,"Reading #BornaCrime @Trevornoah = planning a trip to South Africa #cancerrightnow #cantwait #livebig #stageiv life","853317973213425665",https://twitter.com/shaktifiedOm/status/853317973213425665
fezmayekiso,2017-04-15 13:45,0,"#BornaCrime so real so authentic love it @Trevornoah","853303220059475968",https://twitter.com/fezmayekiso/status/853303220059475968
fezmayekiso,2017-04-15 13:43,0,"Thank you lil bra for this book #BornaCrime I'm in stitches I love my birthday gift can't stop pic.twitter.com/6egqLlaexo","853302681477230592",https://twitter.com/fezmayekiso/status/853302681477230592
thisfishbitch,2017-04-15 13:26,0,"ALSO BORN A CRIME WITH TREVOR NOAH","853298526150946816",https://twitter.com/thisfishbitch/status/853298526150946816
abbello110,2017-04-15 13:23,0,"The more I read ahead " BORN A CRIME " @Trevornoah the more I understand the suffering South Africans experienced during apartheid","853297861961953281",https://twitter.com/abbello110/status/853297861961953281
CindyAppleby1,2017-04-15 12:45,0,"@Trevornoah finished Born a Crime left wondering how CD pirating leads to a comedic career! Working on a 2nd book?","853288141750489091",https://twitter.com/CindyAppleby1/status/853288141750489091
HMSanchez5,2017-04-15 12:39,0,"I highly recommend the book Born a Crime by @Trevornoah . Tale of a mixed race child growing up during #Apartheid #BornaCrime #thedailyshow","853286658556530689",https://twitter.com/HMSanchez5/status/853286658556530689
pierre_jambet,2017-04-15 12:09,0,"Born a Crime by @Trevornoah is a close second, loved that he was narrating it.","853279183463563267",https://twitter.com/pierre_jambet/status/853279183463563267
JDgottaJD,2017-04-15 11:57,0,"Dang! I'm already hooked! #trevornoah #tds #bornacrime @trevornoah @thedailyshow @Baltimore… https://www. instagram.com/p/BS6W4liglyF/","853276051056848896",https://twitter.com/JDgottaJD/status/853276051056848896
VLPGhana,2017-04-15 11:54,0,"Finally finished the audiobook #BornaCrime by Trevor Noah @Trevornoah ... Funny, smart, inspiring and moving....... http:// fb.me/3DxydQWwZ","853275234434129920",https://twitter.com/VLPGhana/status/853275234434129920
Behi_H,2017-04-15 11:53,0,"Couldn't put your book down, read it within 2 days. Was truly fantastic & eye-opening. Thank you @Trevornoah #bornacrime","853275139861082112",https://twitter.com/Behi_H/status/853275139861082112
NwabisaMjoli,2017-04-15 06:37,3,""Black Tax" Trevor Noah - Born a crime pic.twitter.com/sDWrv9HI82","853195558172995588",https://twitter.com/NwabisaMjoli/status/853195558172995588
RozanaDghaily,2017-04-15 06:32,0,"Born a crime by trevor noah. Funny and emotional 1st non-med book ive read in a while","853194432371404800",https://twitter.com/RozanaDghaily/status/853194432371404800
kathrynelspeth,2017-04-15 04:12,0,"5 of 5 stars to Born a Crime by Trevor Noah https:// goodreads.com/review/show/19 72060152 …","853159139270438913",https://twitter.com/kathrynelspeth/status/853159139270438913
danniiieeelllle,2017-04-15 02:40,0,"reading @trevornoah 's thoughts on comfortability in his book Born A Crime scared me... Something about reading yourself into consciousness.","853135849344692224",https://twitter.com/danniiieeelllle/status/853135849344692224
epiphany_7,2017-04-15 02:20,0,"First book that made me cry ' Born a crime ' - Trevor Noah @Trevornoah pic.twitter.com/uGiTEf10nF","853130877139918848",https://twitter.com/epiphany_7/status/853130877139918848
masilomofokeng,2017-04-15 02:06,0,"I’ve entered to win a signed copy of Born a Crime by Trevor Noah, from @edgarsclub ! https:// wn.nr/zScWQ4","853127312295862272",https://twitter.com/masilomofokeng/status/853127312295862272
BridgetHerrin,2017-04-15 01:43,0,"Thanks for joining us @Trevornoah . Highly recommend Born a Crime . pic.twitter.com/W0cZwvt9zE","853121564639756288",https://twitter.com/BridgetHerrin/status/853121564639756288
johnny_five_o,2017-04-15 01:11,0,"On page 51 of 288 of Born a Crime , by Trevor Noah https:// goodreads.com/user_status/sh ow/128576906 …","853113540017782784",https://twitter.com/johnny_five_o/status/853113540017782784
LisaPiccirillo,2017-04-15 00:45,0,"Marked as to-read: Born a Crime by Trevor Noah https:// goodreads.com/review/show/19 71969408 …","853106882986352640",https://twitter.com/LisaPiccirillo/status/853106882986352640
carissaortegon,2017-04-15 00:34,0,"Born a crime by Trevor Noah","853104254780928000",https://twitter.com/carissaortegon/status/853104254780928000
FranManushkin,2017-04-15 00:13,0,"Trevor Noah's book, Born a Crime : a brilliant evocation of his life.","853098947203747840",https://twitter.com/FranManushkin/status/853098947203747840
Joy2th3worldd,2017-04-15 00:10,1,""Being chosen is the greatest gift you can give to another human being" -Trevor Noah #BornACrime","853098145575817216",https://twitter.com/Joy2th3worldd/status/853098145575817216
brixdan,2017-04-15 00:05,0,"5 of 5 stars to Born a Crime by Trevor Noah https://www. goodreads.com/review/show?id =1935899330 …","853096983330009089",https://twitter.com/brixdan/status/853096983330009089
kptuck,2017-04-14 23:10,0,"Just finished " Born a Crime " @Trevornoah - loved the book. Love your mom. Thank you for sharing.","853082995074486272",https://twitter.com/kptuck/status/853082995074486272
josehelizondo,2017-04-14 22:30,0,"Born a Crime . Buy it. Read it. Enjoy it. You're welcome. Thank you @Trevornoah","853072930221305857",https://twitter.com/josehelizondo/status/853072930221305857
Joy2th3worldd,2017-04-14 21:29,0,"Currently reading " Born A Crime ", and it is making me even more excited to see @Trevornoah next week!","853057582839341056",https://twitter.com/Joy2th3worldd/status/853057582839341056
Nasreeta21,2017-04-14 20:36,4,"Your mom's pearls of wisdom are an absolute joy to read. #BornACrime @Trevornoah pic.twitter.com/tZXKpLpA8a","853044314917744641",https://twitter.com/Nasreeta21/status/853044314917744641
jaldous,2017-04-14 19:45,0,"4 of 5 stars to Born a Crime by Trevor Noah https://www. goodreads.com/review/show?id =1971584508 …","853031539801829376",https://twitter.com/jaldous/status/853031539801829376
MaryWWalters,2017-04-14 19:30,0,"4 of 5 stars to Born a Crime by Trevor Noah https://www. goodreads.com/review/show/19 71753299 …","853027698259750912",https://twitter.com/MaryWWalters/status/853027698259750912
EA_Hennessy,2017-04-14 18:33,0,"Book Review: Born a Crime by Trevor Noah https:// eahennessy.wordpress.com/2017/04/14/boo k-review-born-a-crime-by-trevor-noah … pic.twitter.com/tTw6sdoO9V","853013280004202496",https://twitter.com/EA_Hennessy/status/853013280004202496
Zammy_Khanyile,2017-04-14 17:48,0,"Born A Crime https:// twitter.com/Just_Jozi/stat us/852661749283213312 …","853001992268124160",https://twitter.com/Zammy_Khanyile/status/853001992268124160
Elizabe12571216,2017-04-14 17:16,0,"@Trevornoah what an amazing book, and the ending had me on edge! #BornaCrime","852993947655864320",https://twitter.com/Elizabe12571216/status/852993947655864320
iamOnosz,2017-04-14 16:00,0,"" Born A Crime " Trevor Noah.","852974826268524544",https://twitter.com/iamOnosz/status/852974826268524544
JocelynZombie,2017-04-14 15:01,0,"" Born a Crime " is so good! I highly recommend getting it on audio - it looses so much without his voice. I started it in print & switched.","852959978843291648",https://twitter.com/JocelynZombie/status/852959978843291648
DeeGloria,2017-04-14 12:15,0,"@Trevornoah just finished reading an amazing story of determination - Born a crime , wow...look at u now, u are true inspiration. Salute!!!","852918329576747008",https://twitter.com/DeeGloria/status/852918329576747008
shawndavidtampa,2017-04-14 12:13,0,"Reading @Trevornoah " Born a Crime ." Excellent and rife with juicy quotes. "Being chosen is the greatest gift you can give another person..."","852917707284590593",https://twitter.com/shawndavidtampa/status/852917707284590593
lansingkm,2017-04-14 11:49,0,"What's everyone reading this weekend? My #FridayReads is Born a Crime by Trevor Noah!","852911780472827904",https://twitter.com/lansingkm/status/852911780472827904
Spastika,2017-04-14 11:29,0,"Ek luister Trevor Noah se " Born a Crime " en kleur Frozen in. @Meerensee https://www. instagram.com/p/BS3u537F7ps/","852906661987721216",https://twitter.com/Spastika/status/852906661987721216
sarevao,2017-04-14 10:40,0,"Highly recommended: the audiobook of @Trevornoah 's " Born a Crime " via @audible_com http://www. audible.com/pd/Bios-Memoir s/Born-a-Crime-Audiobook/B01IW9TQPK …","852894444764504065",https://twitter.com/sarevao/status/852894444764504065
BookDigits,2017-04-14 09:50,0,"Have you read our Book of the Week, “ Born a Crime ”’by @trevornoah , yet? If not, add if to your To-Read list now: http:// bookdigits.com/book?ID=1401192","852881685620371457",https://twitter.com/BookDigits/status/852881685620371457
MEGBERB,2017-04-14 09:21,0,"Born a crime by Trevor Noah","852874472772296704",https://twitter.com/MEGBERB/status/852874472772296704
SheBeeGee,2017-04-14 09:07,0,"Sitting in Skoobs enjoying a flat white & @Trevornoah 's Born a Crime . Came for quiet, instead got two fat kids fighting over cake next door","852870825556443139",https://twitter.com/SheBeeGee/status/852870825556443139
abbello110,2017-04-14 07:34,0,"Long wait is over, " BORN A CRIME " by @Trevornoah delivered yesterday @amazon . Through with first chapter, on to the next... pic.twitter.com/fTRlLpGTl5","852847432765517830",https://twitter.com/abbello110/status/852847432765517830
CycieyCynthia,2017-04-14 07:07,0,"Born a crime nimesoma so the rest","852840835486011392",https://twitter.com/CycieyCynthia/status/852840835486011392
AuHCSouthAfrica,2017-04-14 06:41,0,"Finally read @Trevornoah #BornACrime , that very best combination: funny and educational - a must read for those who have not already","852834159047438336",https://twitter.com/AuHCSouthAfrica/status/852834159047438336
JustLavish__,2017-04-14 05:16,0,"Read and then you lend me Born a Crime https:// twitter.com/moniangoh2030/ status/852812325790695429 …","852812723498786816",https://twitter.com/JustLavish__/status/852812723498786816
ForeverThato,2017-04-14 04:52,0,"Trvor Noah: Born A Crime https:// twitter.com/Just_Jozi/stat us/852661749283213312 …","852806637492461568",https://twitter.com/ForeverThato/status/852806637492461568
LaughnDigital,2017-04-14 04:06,65,"Trevor Noah - Born a crime pic.twitter.com/sn6qGeHI33","852795239039344641",https://twitter.com/LaughnDigital/status/852795239039344641
BiyiToluwalase,2017-04-14 02:58,0,"Book Review: Born A Crime by Trevor Noah http:// biyitolu.com.ng/book-review-bo rn-a-crime-trevor-noah/ …","852778078090567680",https://twitter.com/BiyiToluwalase/status/852778078090567680
junesicles,2017-04-14 02:03,0,"Just started @Trevornoah 's Born a Crime (finally) & already laughing, crying, thinking, learning. It's freaking good guys","852764298937892865",https://twitter.com/junesicles/status/852764298937892865
elite5091,2017-04-14 01:00,0,"91% done with Born a Crime , by Trevor Noah https:// goodreads.com/user_status/sh ow/128479718 …","852748263413268480",https://twitter.com/elite5091/status/852748263413268480
hookandquill,2017-04-14 00:23,0,"Have you ever read an autobiography as if the person was reading to you? #BornaCrime","852739185647562756",https://twitter.com/hookandquill/status/852739185647562756
LexieBraverman,2017-04-14 00:23,0,"@Trevornoah this girl stayed up past her grandmabedtime Bc she couldn't put #Bornacrime down. Thank you, crying now, and calling my mom.","852739106643689473",https://twitter.com/LexieBraverman/status/852739106643689473
mcrlyric_bot,2017-04-13 23:49,6,"You were always born a crime We salute you in your grave","852730406440886273",https://twitter.com/mcrlyric_bot/status/852730406440886273
rnegron86,2017-04-13 22:46,1,"@Trevornoah so perfectly & succinctly captured the difference between a "handout" & a hand up. I love this so much. #BornaCrime Great read. pic.twitter.com/S9wptst5Zh","852714636633833472",https://twitter.com/rnegron86/status/852714636633833472
andrewjgrimaldi,2017-04-13 21:53,0,"Finished listening to Born a Crime : Stories from a South African Childhood ... by .... Try #Audible and get it free: https://www. audible.com/pd?asin=B01IW9 TQPK&source_code=AFAORWS04241590G4 …","852701254023344128",https://twitter.com/andrewjgrimaldi/status/852701254023344128
unqualifiedL,2017-04-13 20:41,0,"@Trevornoah I'm OBSESSED with your book #BornaCrime thank you for taking the time to read it to me on @audible_com it makes it 10x better! pic.twitter.com/8lLyVPgj2g","852683085535522817",https://twitter.com/unqualifiedL/status/852683085535522817
whoneedssalad,2017-04-13 20:29,0,"Just finished Born a Crime by @Trevornoah — It was an honest,candid and heartfelt read.Much respect to him for getting to where he is today.","852680129000222721",https://twitter.com/whoneedssalad/status/852680129000222721