bethgbooks,2013-01-15 17:58,0,"Solid investment. #tinafey #bossypants http:// instagr.am/p/UhaFwULtMT/","291318370505203713",https://twitter.com/bethgbooks/status/291318370505203713
bossypants_,2013-01-15 17:28,0,"@frooootloop haha, love you x","291310819449393153",https://twitter.com/bossypants_/status/291310819449393153
bossypants_,2013-01-15 17:27,0,"#TalkLikeYorBestFriend Aww mate, dat ass, reconsider your life, aww man, justin,justin,justin, I make every romantic thing unromantic","291310574258749440",https://twitter.com/bossypants_/status/291310574258749440
SarahDMalone,2013-01-15 17:15,0,"" Bossypants " by Tina Fey...audiobook...narrated by Tina Fey...in my car...Tina Fey in my speakers...I'm in heaven! #Bossypants","291307619107340289",https://twitter.com/SarahDMalone/status/291307619107340289
wastecaseface,2013-01-15 17:12,0,"Reading #TinaFey 's #Bossypants and all she talks about it #Chicago looks like I'm finally gonna go to #SecondCity ! pic.twitter.com/cIBaVZkA","291306771799228416",https://twitter.com/wastecaseface/status/291306771799228416
SL_Ross,2013-01-15 16:59,0,"On page 108 of 277 of Bossypants , by Tina Fey http:// bit.ly/TYSPpF","291303620232753152",https://twitter.com/SL_Ross/status/291303620232753152
sallyrugg,2013-01-15 16:28,0,"Listening to Tina Fey's Bossypants on the crowded morning commute sure breeds concern from other passengers... "Why is that girl snorting!?"","291295841413636096",https://twitter.com/sallyrugg/status/291295841413636096
holaholaalywolf,2013-01-15 16:10,0,"Hooray work with bossy mc bossypants","291291395229106176",https://twitter.com/holaholaalywolf/status/291291395229106176
creativebloke,2013-01-15 15:33,0,"finished Bossypants by Tina Fey and gave it 4 stars http:// amzn.to/efqXa9","291281890827202560",https://twitter.com/creativebloke/status/291281890827202560
bossypants_,2013-01-15 15:28,1,"if you don't wanna take it slow and you just wanna take me homeeee","291280691260444672",https://twitter.com/bossypants_/status/291280691260444672
karenstivali,2013-01-15 15:04,0,"Writing group is calling me BossyPants b/c I assigned food for dinner mtg. I told them it's either BossyPants or NoPants, choice is theirs.","291274803028033537",https://twitter.com/karenstivali/status/291274803028033537
bertyc,2013-01-15 15:03,0,"I finished reading Tina Fey's Bossypants last night. It's very funny, I think I love her. Who wants to borrow it next? #twitterlibrary","291274371622916096",https://twitter.com/bertyc/status/291274371622916096
cupcakegirly,2013-01-15 15:02,0,"OK Mr. Bossypants ! ;) @rklipman @trishaleighKC","291274153791737858",https://twitter.com/cupcakegirly/status/291274153791737858
MeDoMeself,2013-01-15 14:46,0,"@JeffersonCovey1 ok ok ok. #BossyPants","291270268201082881",https://twitter.com/MeDoMeself/status/291270268201082881
celesteasaurus,2013-01-15 14:45,0,"@LiaSeth also that book I linked IS nonfiction. but if you liked Bossypants , it is EVEN BETTER","291269890449498113",https://twitter.com/celesteasaurus/status/291269890449498113
therealBRB,2013-01-15 14:44,0,"i think i need someone right now that i could refer to as 'lil miss. bossypants ', you know, to keep me in line with everything","291269762854559744",https://twitter.com/therealBRB/status/291269762854559744
hansen_kelly,2013-01-15 14:41,0,"Can't stop reading Bossypants pic.twitter.com/33sDrfXE","291268904670617600",https://twitter.com/hansen_kelly/status/291268904670617600
BTNMikeHall,2013-01-15 14:01,0,"This joke has been cracking me up all day- from the book Bossypants and @KayKayCannon http:// lockerz.com/s/277119165","291258888437784577",https://twitter.com/BTNMikeHall/status/291258888437784577
leahcstewart,2013-01-15 13:52,0,"@sarahdessen Got the Lowe, thanks. I've read Bossypants but might have to get it just to hear Tina Fey read it.","291256486506684416",https://twitter.com/leahcstewart/status/291256486506684416
sarahdessen,2013-01-15 13:30,0,"@leahcstewart I'm partial to celeb memoirs on audio. BOSSYPANTS , STORIES I ONLY TELL MY FRIENDS, GIRL WALKS INTO A BAR are all good ones!","291250943331282946",https://twitter.com/sarahdessen/status/291250943331282946
TheSarahFuller,2013-01-15 13:02,0,"The only thing making this day of being locked out of my work computer is #Bossypants how am I just now reading this literary masterpiece","291244030652731394",https://twitter.com/TheSarahFuller/status/291244030652731394
ChandlerArtsGM,2013-01-15 12:41,0,"3 hour layover! Gonna read Bossypants . (@General Mitchell International Airport (MKE) w/ 13 others) http:// 4sq.com/13zEa7e","291238606419406848",https://twitter.com/ChandlerArtsGM/status/291238606419406848
ilabean,2013-01-15 12:03,0,"Also-go read Bossypants . Tina Fey is amazing and hilarious and sweet and brilliant. Seriously. Do it now.","291229236193280000",https://twitter.com/ilabean/status/291229236193280000
jordaneve_,2013-01-15 11:46,0,"finishing #BossyPants to ensue happiness & laughter & moving on to @BillSimmons #TheBookofBasketball thats right folks ima be a bball expert","291224921718288385",https://twitter.com/jordaneve_/status/291224921718288385
bossypants_,2013-01-15 11:15,0,"the snow is so pretty","291217141565386752",https://twitter.com/bossypants_/status/291217141565386752
RoanneCLee,2013-01-15 08:57,0,"bossypants tells me I'm signed up for a 5am appointment at the gym. no response","291182213347831809",https://twitter.com/RoanneCLee/status/291182213347831809
Ameilios,2013-01-15 08:48,0,"bossypants : http:// tmblr.co/Zlc4-xbpw2wW","291180009622749185",https://twitter.com/Ameilios/status/291180009622749185
Reader_Fictions,2013-01-15 08:31,0,"20% done with Bossypants , by Tina Fey: Not currently feeling this one, so took a break to listen to Stardust. http:// bit.ly/TXT58m","291175849670082560",https://twitter.com/Reader_Fictions/status/291175849670082560
hilarybassett,2013-01-15 08:16,0,"I must seem like a total lunatic on the TTC laughing to myself. Tina Fey's Bossypants is tooooo funny. So good","291172063341854720",https://twitter.com/hilarybassett/status/291172063341854720
abuyonce,2013-01-15 06:14,0,"@hsweetd bossypants by tina fey is so funny! Mandela's way...dr.Mahathir's","291141286612832256",https://twitter.com/abuyonce/status/291141286612832256
mmadison,2013-01-15 05:21,0,"I finished Bossypants @biancatweetz I dunno what to do with my life nowww","291127970779774978",https://twitter.com/mmadison/status/291127970779774978
Kristyn_L,2013-01-15 04:27,0,""Amazon vous recommande Bossypants ". Amazon devrait prendre en compte mes commandes passées avant de me proposer des articles que j'ai déjà","291114380324659200",https://twitter.com/Kristyn_L/status/291114380324659200
sracine,2013-01-15 04:11,0,"I'm listening to Bossypants by Tina Fey. Awesome book! :)","291110458256142336",https://twitter.com/sracine/status/291110458256142336
bossypants_,2013-01-15 03:19,0,"maths must be the worst thing to have first thing in the morning","291097260173963264",https://twitter.com/bossypants_/status/291097260173963264
bossypants_,2013-01-15 03:15,1,"mornings are so much better when I have time for coffee","291096236264681472",https://twitter.com/bossypants_/status/291096236264681472
lenadoubleyou,2013-01-15 03:14,0,"It's taking me about six months to finish Into the Wild, but I just finished reading Bossypants (for the second time) in about 5 hours.","291095959985856512",https://twitter.com/lenadoubleyou/status/291095959985856512
JackAttack522,2013-01-15 00:44,0,"Reading Bossypants ...gotta love Tina Fey","291058215863599106",https://twitter.com/JackAttack522/status/291058215863599106
shesaidwhhaaat,2013-01-15 00:39,0,"@GrandeAllan lol nooooooo! mr. bossypants .. ._.","291057100686237696",https://twitter.com/shesaidwhhaaat/status/291057100686237696
tyranno_bex357,2013-01-15 00:38,0,"just read bossypants in one nite #ihavenolife","291056677460013056",https://twitter.com/tyranno_bex357/status/291056677460013056
AllmyAnnie,2013-01-15 00:31,0,"@april_mclean I've read Bossypants , hysterical! I actually have three books going. Hehehe.","291054925365006336",https://twitter.com/AllmyAnnie/status/291054925365006336
brianite,2013-01-15 00:14,0,"I went through the audiobook for Bossypants about as fast as I went through the book.","291050701449203712",https://twitter.com/brianite/status/291050701449203712
EmilyHdz94,2013-01-15 00:00,0,"Photo: bossypants : http:// tmblr.co/ZONaRyborORh","291047125037481986",https://twitter.com/EmilyHdz94/status/291047125037481986
ginamom,2013-01-14 23:26,0,"Started that on my Kindle as well... she's awesome! RT @laineyd7 : 5 of 5 stars to Bossypants by Tina Fey http:// bit.ly/X9I4yk","291038707828551680",https://twitter.com/ginamom/status/291038707828551680
annafwhittemore,2013-01-14 23:25,0,"Yay for Bossypants ! #tinafey pic.twitter.com/CNs98v27","291038429700046848",https://twitter.com/annafwhittemore/status/291038429700046848
markgasparovic,2013-01-14 23:25,0,"@sarahcolonna after reading her book #Bossypants ... absolutely! #CouldNotAgreeMore","291038413887508480",https://twitter.com/markgasparovic/status/291038413887508480
stefrose,2013-01-14 23:14,0,"@sah530 thanks! I'm not a fan of distance running too... you should try Tina Fey's Bossypants next if you haven't already!","291035606069415936",https://twitter.com/stefrose/status/291035606069415936
laineyd7,2013-01-14 22:49,0,"5 of 5 stars to Bossypants by Tina Fey http:// bit.ly/X9I4yk","291029432909578241",https://twitter.com/laineyd7/status/291029432909578241
olgakwak,2013-01-14 22:14,0,"Besides, laughter is the best medicine. Just take a copy of Bossypants for a spin in your iPhone. Try and contain your laughter on the bus.","291020559247093760",https://twitter.com/olgakwak/status/291020559247093760
MeggieToTheMax,2013-01-14 22:13,0,"I hope @JourneyTH is enjoying Bossypants ! Hopefully he knows how to operate a book. :P","291020241016848386",https://twitter.com/MeggieToTheMax/status/291020241016848386
ForPetersSake_,2013-01-14 22:07,0,"I'm reading Bossypants http:// is.gd/8oIFeL #GetGlue #Bossypants","291018867302625280",https://twitter.com/ForPetersSake_/status/291018867302625280
AlexaRodr09,2013-01-14 22:05,0,"Regular show: The bossypants by *Sindorman on deviantART http:// whrt.it/X9D78B","291018127326707713",https://twitter.com/AlexaRodr09/status/291018127326707713
umapurpleninja,2013-01-14 22:01,0,"Regular show: The bossypants by *Sindorman on deviantART http:// whrt.it/UmeDdV","291017278332477440",https://twitter.com/umapurpleninja/status/291017278332477440
Jerrry_YDG,2013-01-14 21:54,0,"@_Eseneahh fine. I will! #BossyPants","291015360847704064",https://twitter.com/Jerrry_YDG/status/291015360847704064
han__dizzle,2013-01-14 21:49,0,"Ugh watching tennis suuuuucks. Really wish Sue wasn't so obsessed with it. Oh well, I'll just read Bossypants instead.","291014164292440065",https://twitter.com/han__dizzle/status/291014164292440065
kimberrymuffin,2013-01-14 21:39,0,"68% done with Bossypants , by Tina Fey: So slooooow... http:// bit.ly/X9A7cw","291011643599630337",https://twitter.com/kimberrymuffin/status/291011643599630337
Books_web,2013-01-14 20:11,0,"【Entertainment】 Bossypants by Tina Fey http://www. amazon.com/gp/product/B00 47Y0FGY?ie=UTF8&tag=bnd011-20&linkCode=shr&camp=213733&creative=393177&creativeASIN=B0047Y0FGY&ref_=zg_bs_86_2 …","290989491852808192",https://twitter.com/Books_web/status/290989491852808192
rosieferg,2013-01-14 20:06,0,"@stoakleyaudio @torontomike bossypants","290988313907699712",https://twitter.com/rosieferg/status/290988313907699712
liveoakplga,2013-01-14 20:05,0,"Can't get enough Tina Fey & Amy Poehler? We've got Parks & Rec, 30 Rock DVDs http:// ow.ly/gO4CH , ' Bossypants ' & more! http:// ow.ly/gO4GQ","290987963502964737",https://twitter.com/liveoakplga/status/290987963502964737
KazSami,2013-01-14 19:09,0,"Reading Tina Fey's Bossypants while waiting for HIMYM is on. Gonna PVR it just in case I don't notice the time","290974019249922048",https://twitter.com/KazSami/status/290974019249922048
PrisBlossom,2013-01-14 19:01,0,"I left #Bossypants in Sanford. Nooooooooooooooooooo!","290971861225975808",https://twitter.com/PrisBlossom/status/290971861225975808
sheysue,2013-01-14 18:35,0,"Can't wait to read Tina Fey's Bossypants book.","290965347262148608",https://twitter.com/sheysue/status/290965347262148608
kcassidyf,2013-01-14 18:28,0,"@sweetneatt books-check! Already finished Bossypants and halfway done book 1 GoT. Perhaps knitting it is... Thanks!","290963643967873025",https://twitter.com/kcassidyf/status/290963643967873025
InsteadSoftcup,2013-01-14 17:40,0,"Tina Fey's thoughts on menstruation from her book Bossypants : http:// ow.ly/gNPhS","290951505601785856",https://twitter.com/InsteadSoftcup/status/290951505601785856
RobJGoldE,2013-01-14 17:22,0,"@KatPace #bossypants","290946915850395649",https://twitter.com/RobJGoldE/status/290946915850395649
WadeOnTweets,2013-01-14 17:12,0,"@griner Steve Jobs, Bossypants , Band of Brothers, Stop Stealing Dreams.","290944612133122048",https://twitter.com/WadeOnTweets/status/290944612133122048
taryn__anne,2013-01-14 17:11,0,"Tina Feys Bossypants or Tucker Max's Assholes Finish First for my airport reading? I can't decide at all.","290944255214641152",https://twitter.com/taryn__anne/status/290944255214641152
Hails16_,2013-01-14 17:07,0,"This is my FAVORITE picture of @TannerBryant7 ever!!! #bossypants #loveyou http:// instagr.am/p/UevMGvvK-o/","290943222455361537",https://twitter.com/Hails16_/status/290943222455361537
henryitdean,2013-01-14 16:53,0,"Finished Bossypants , now I get to crack on with this bad boy... http:// instagr.am/p/Uet5fHk6zH/","290939745213743104",https://twitter.com/henryitdean/status/290939745213743104
nigelsowner,2013-01-14 16:41,0,"@whatdinoto "and I gave birth at my age, it would just be a ball of fingers"...can't slip that BossyPants reference past me, Tina. #bigfan","290936596524589059",https://twitter.com/nigelsowner/status/290936596524589059
Anele,2013-01-14 16:16,0,"It is awesome !!! RT @ladysans : Thinks its time to finally read Tina Fey's Bossypants ! *checks iBooks*","290930410928619520",https://twitter.com/Anele/status/290930410928619520
Aisling_Gheal,2013-01-14 16:14,0,"@susankilkenny It's sarcastic pants Seth McFarlane, unfortunately. Have you read Tina's book Bossypants ? If not, you MUST-it's brilliant.","290929859339902976",https://twitter.com/Aisling_Gheal/status/290929859339902976
KassandraKAPOW,2013-01-14 16:10,0,"I'm really enjoying this book on Tina Fey titled " Bossypants ". It's so funny!","290928793256882178",https://twitter.com/KassandraKAPOW/status/290928793256882178
mitzpa,2013-01-14 16:02,0,"@elleinthecity BOSSYPANTS is an ideal audiobook to get started with! The writing, the pacing, and performance are all perfect for the format","290926788924825600",https://twitter.com/mitzpa/status/290926788924825600
atomiclemon,2013-01-14 16:01,0,"I mean, does tina fey care if I thought bossypants was boring? doubt it.","290926692468416512",https://twitter.com/atomiclemon/status/290926692468416512
a2,2013-01-14 16:01,0,"@conorreid @admhawrth I don’t really care for non-fiction, unless it’s funny like Bossypants or interesting like Steve Jobs’ bio.","290926638282182656",https://twitter.com/a2/status/290926638282182656
elleinthecity,2013-01-14 15:58,0,"@mitzpa Well, Maja's suggestion on trying Bossypants on audio was the charm…I loved the book in audio format.","290926006192177153",https://twitter.com/elleinthecity/status/290926006192177153
ladysans,2013-01-14 15:58,0,"Thinks its time to finally read Tina Fey's Bossypants ! *checks iBooks*","290925824411041792",https://twitter.com/ladysans/status/290925824411041792
TamoTweets,2013-01-14 15:34,1,"Between 30 Rock, Bossypants & Golden Globes, I could not be any more obsessed!!! #TinaFey #Idol","290919811469414402",https://twitter.com/TamoTweets/status/290919811469414402
KingLibraries,2013-01-14 14:47,1,"Golden Globes host Tina Fey's book " Bossypants ", is available for checkout at our King City location!","290907894289940481",https://twitter.com/KingLibraries/status/290907894289940481
wuthering_alice,2013-01-14 14:45,0,"@UrsulaGlitch Hmmm. Bossypants is a quicker read, but Moranthology is a dip in and outer.","290907540810768384",https://twitter.com/wuthering_alice/status/290907540810768384
CityLightsLondn,2013-01-14 14:43,0,"Read " Bossypants " for two reasons A: Its intelligent and funny. B: It's relatively short, but looks big so you can impress your friends.","290906888130949120",https://twitter.com/CityLightsLondn/status/290906888130949120
iamlofo,2013-01-14 14:25,0,"@Paulachowles try reading Tina's book Bossypants ... That woman is an incredible talent. Can't put it down so tweeting with one hand","290902565795790848",https://twitter.com/iamlofo/status/290902565795790848
AlishaAwesome,2013-01-14 14:18,0,"So excited!! #tinafey #bossypants #book #target @Target http:// instagr.am/p/UecLKAha79/","290900763109113856",https://twitter.com/AlishaAwesome/status/290900763109113856
KSpitzberg,2013-01-14 14:12,0,"@10Atticus Okay bossypants . #takeiteasy","290899302165929987",https://twitter.com/KSpitzberg/status/290899302165929987
ismisemolly,2013-01-14 13:57,0,"My sweetheart of a boyfriend @altWilliam surprised me with Tina Fey's book Bossypants today! :) I love him to bits so I do","290895522779242496",https://twitter.com/ismisemolly/status/290895522779242496
johnsfram,2013-01-14 13:50,0,"@postitbreakup wow, just finished it. i was really hoping they would start beating up bossypants , which makes me worried at myself","290893743257702400",https://twitter.com/johnsfram/status/290893743257702400
mandybc,2013-01-14 13:24,0,"bossypants é melhor que café :)))))","290887040684400641",https://twitter.com/mandybc/status/290887040684400641
sarah_pawluk,2013-01-14 12:36,0,"Props to my mom for finishing Bossypants . Loved discussing Tina Fey's life with my mother. #proud","290875028487159811",https://twitter.com/sarah_pawluk/status/290875028487159811
alphajustakid,2013-01-14 12:12,0,"@faithyerin bossypants was awesome if you havent read it! also, world war Z was great. recommendations depend on what you like to read 8)","290868904404869120",https://twitter.com/alphajustakid/status/290868904404869120
amandaelaineh,2013-01-14 12:07,0,"@Hiatt_Woods she is my idol. Listening to her audio book right now! #bossypants #tinaforpresident","290867684105674752",https://twitter.com/amandaelaineh/status/290867684105674752
mingasm,2013-01-14 12:05,0,"@val_friends Bossypants was fantastic right?","290867225051668481",https://twitter.com/mingasm/status/290867225051668481
johnsfram,2013-01-14 11:52,0,"@postitbreakup bossypants definitely doesn't know a good thing when he has it","290863970150125569",https://twitter.com/johnsfram/status/290863970150125569
Hiatt_Woods,2013-01-14 11:23,0,"Chapter 1 of Bossypants ...Tina, you silly, self-aware woman you; you should host an award show. Not by yourself of course, too much pressure","290856777644400640",https://twitter.com/Hiatt_Woods/status/290856777644400640
sarah_gwz,2013-01-14 11:13,0,"“To say I’m an overrated troll, when you have never even seen me guard a bridge, is patently unfair.” - Tina Fey, " Bossypants "","290854197195313152",https://twitter.com/sarah_gwz/status/290854197195313152
SandraTayler,2013-01-14 10:57,0,"@RandyTayler @HeidiTighe I just finished reading Bossypants . I really enjoyed it.","290850066023976960",https://twitter.com/SandraTayler/status/290850066023976960
bossypants_,2013-01-14 10:56,0,"lunch was so funny with hev today","290849939259547649",https://twitter.com/bossypants_/status/290849939259547649
AuraofDreams,2013-01-14 10:54,0,"@EccentricFella Yeah I wanted to. I read Tina Fey's Bossypants last year where she has written abt Amy Poehler too. Curious about the pair.","290849441596977153",https://twitter.com/AuraofDreams/status/290849441596977153
deb_theartist,2013-01-14 10:50,0,"I need to finish Bossypants by the end of the month.","290848323890475010",https://twitter.com/deb_theartist/status/290848323890475010
TVDquotes2013,2013-01-14 10:45,0,"Damon-"Is that where you've been all morning, out buying bossypants ?" S4 Ep5","290847207874252802",https://twitter.com/TVDquotes2013/status/290847207874252802
Dancndoll,2013-01-14 10:22,0,"After last nights #GoldenGlobes I was reminded how I have yet to read ' Bossypants ' by tina fey. Once i finish 'Killing Kennedy' I'm doing it","290841345822707712",https://twitter.com/Dancndoll/status/290841345822707712
Barbidaldal,2013-01-14 09:47,0,""Wonderful Filipinos.." As described in Tina Fey's book Bossypants . @florenceranola pic.twitter.com/v56pkYS","290832537146781696",https://twitter.com/Barbidaldal/status/290832537146781696
FaithErinHicks,2013-01-14 09:19,1,"Woke up grumpy so listened to Tina Fey's Bossypants audiobook while jogging. Still grumpy but at least jogging's over & Tina Fey exists.","290825457643954176",https://twitter.com/FaithErinHicks/status/290825457643954176
nataliemcmillan,2013-01-14 08:57,0,"My attempt to read Bossypants in the airport has resulted in me sobbing silently while trying to contain my laughter. #peoplethinkiminpain","290819846755729408",https://twitter.com/nataliemcmillan/status/290819846755729408
allieroseknows,2013-01-14 08:56,0,"@MsSunili that's probably the ONE thing that irks me about Tina Fey's comedy - when she makes jokes about sex workers (30 rock, Bossypants )","290819744066584577",https://twitter.com/allieroseknows/status/290819744066584577
lauraleishman,2013-01-14 08:27,0,""Technology doesn't move backwards. No society has ever de-industrialised. Which is why photoshop is here to stay." #Bossypants","290812305866899456",https://twitter.com/lauraleishman/status/290812305866899456
lauraleishman,2013-01-14 08:17,0,""...unless I need it, in which case everybody be cool." #Bossypants","290809911695265792",https://twitter.com/lauraleishman/status/290809911695265792
mfcrocker,2013-01-14 07:58,0,"FAO @dufresney : RT @mikebull Anyone read Bossypants by Tina Fey? Is it worth buying?","290805101524832257",https://twitter.com/mfcrocker/status/290805101524832257
_fplusk,2013-01-14 07:53,0,"jadi panggilan kamu buat saya mr. bossypants . | oh crap.","290803927736262656",https://twitter.com/_fplusk/status/290803927736262656
mikebull,2013-01-14 07:52,0,"Anyone read Bossypants by Tina Fey? Is it worth buying?","290803636890648576",https://twitter.com/mikebull/status/290803636890648576
andreawhoo,2013-01-14 07:52,0,"@JennConsignado bossypants : tina fey | gooooo read! :)","290803507148226561",https://twitter.com/andreawhoo/status/290803507148226561
fhnsmiley,2013-01-14 07:51,0,"OK peeps, it's been fun. I'm off to bed to listen to some Bossypants because I have #FeyFeels . Night!","290803342983196673",https://twitter.com/fhnsmiley/status/290803342983196673
LeftArmOver_,2013-01-14 07:44,0,"This is as good a time as it will ever be to recommend Bossypants by Tina Fey. As random as it gets.","290801516552519680",https://twitter.com/LeftArmOver_/status/290801516552519680
KellyAnneVoice,2013-01-14 06:41,0,"@chloe_aust ooh cool will check that out for sure. Thank you. Just downloading Tina Fey's Bossypants so will let you know if any good x","290785791091822592",https://twitter.com/KellyAnneVoice/status/290785791091822592
UrsulaGlitch,2013-01-14 05:51,0,"Bossypants and Moranthology just turned up in the post. HOOORAY for reading.","290773026256076800",https://twitter.com/UrsulaGlitch/status/290773026256076800
LittleBrownUK,2013-01-14 04:39,0,"Her memoir Bossypants is 'PROPERLY hilarious' according to the hilarious-herself @sueperkins . We agree.","290754986814615552",https://twitter.com/LittleBrownUK/status/290754986814615552
medeana,2013-01-14 04:15,0,"@robotnic Thank youuuuuu. I read bossypants and it was so fun. i'll pick up Diaz' other stuff and also Burroughs. Excited!","290748953404768256",https://twitter.com/medeana/status/290748953404768256
ShelaghFogarty,2013-01-14 04:02,0,"@sueperkins @emmak67 I read Bossypants on train - laughed from my bone marrow outwards. Fellow passengers thought I was in distress.","290745785858015232",https://twitter.com/ShelaghFogarty/status/290745785858015232
VivGroskop,2013-01-14 04:01,0,"Tina Fey's Bossypants : "a masterpiece in comedy writing" http:// tinyurl.com/426r8ep RECOMMENDED. Read it. Read it. Read it.","290745409767370752",https://twitter.com/VivGroskop/status/290745409767370752
sueperkins,2013-01-14 03:58,0,"@EmmaK67 You read Bossypants ? PROPERLY hilarious","290744726880145409",https://twitter.com/sueperkins/status/290744726880145409
bossypants_,2013-01-14 03:23,0,"too cuteeee, awww.","290735981571760128",https://twitter.com/bossypants_/status/290735981571760128
bossypants_,2013-01-14 03:21,0,"lunch with hev today, aww. can tell she's got a lot of goss.","290735268410052608",https://twitter.com/bossypants_/status/290735268410052608
paigekimm,2013-01-14 02:26,0,"I highly recommend you read Bossypants by Tina Fey. Or just the back of the book, that too. #girlcrush pic.twitter.com/DuLvUr14","290721517917061120",https://twitter.com/paigekimm/status/290721517917061120
BookishComforts,2013-01-14 02:21,0,"I read Bossypants by Tina Fey http:// bit.ly/WEVjqb","290720223215095808",https://twitter.com/BookishComforts/status/290720223215095808
tintonwonton,2013-01-14 01:37,0,"The highlighting feature on kindles is dangerous while reading Tina Fey's Bossypants #yellowpages","290709235162038272",https://twitter.com/tintonwonton/status/290709235162038272
cebinger,2013-01-14 01:35,0,"finished bossypants just in time for the golden globes! #enlightened #yourocktina","290708775353081856",https://twitter.com/cebinger/status/290708775353081856
followcarolina,2013-01-14 01:01,0,"@SonrieItsErika you should read #Bossypants ! "Do what you want. Don't fucking care if they like it." #tinafey","290700072092590080",https://twitter.com/followcarolina/status/290700072092590080
